tablescraper-selected-row href,Club Name,Description Excerpt
https://now.calpoly.edu/organization/islaclub,Cal Poly ISLA Club,"Cal Poly ISLA Club provides information, community, and support for ISLA majors or those interested in the major."
https://now.calpoly.edu/organization/juggling,Cal Poly Juggling Club,"We meet to learn new tricks, practice our old ones, and spread the joy of juggling by teaching others."
https://now.calpoly.edu/organization/calpolyjumpropeclub,Cal Poly Jump Rope Club,"Competitive and performance jump rope team dedicated to spreading the sport of jump rope to Cal Poly! Jump rope is no longer just an activity for kids on the playground; it is a fun, challenging, and creative sport! No prior experience necessary!"
https://now.calpoly.edu/organization/cpkaaram,Cal Poly Kaaram Dance Club,The organization is a non-audition fusion Indian dance team primarily focusing on South Indian dance styles.
https://now.calpoly.edu/organization/slolers,Cal Poly League of Legends Club,Provide a campus community for both casual and competitive league of legends players to participate in. Join our Discord server! https://discord.gg/VBSaTxu
https://now.calpoly.edu/organization/cplug,Cal Poly Linux Users Group,"We're both users and fans of the GNU/Linux Operating System, and we want you to be too. We have regular talks and meetings, as well as social events when the opportunity arises."
https://now.calpoly.edu/organization/calpolyloreclub,Cal Poly Lore Club,"Cal Poly Lore Club strives to create an inclusive environment to foster respectful discussions of various fictional works, ranging from videogames to literature. All opinions and theories are welcome, as multiple perspectives are key to understanding."
https://now.calpoly.edu/organization/magic,Cal Poly Magic the Gathering Club,We foster a campus community of Magic: The Gathering players. We host weekly events featuring a wide array of formats. Join our Discord server to find games or just talk MTG!
https://now.calpoly.edu/organization/cpmarksmenship,Cal Poly Marksmanship Club,The Cal Poly Marksmanship Club is a student organization that centers around safe and controlled practice of the shooting sports.
https://now.calpoly.edu/organization/mbvc,Cal Poly Men's Beach Volleyball Club,"We are a competitive yet social men's beach volleyball club. We have scheduled practices weekly and compete in third party tournaments up and down the coast of California. We compete against club teams from other colleges such as USC, UCLA, etc."
https://now.calpoly.edu/organization/cplax,Cal Poly Men's Lacrosse Club,"The Cal Poly Lacrosse Club is a highly competitive, organized, and professional club sport. We compete with teams nationwide in the MCLA as well as locally in the WCLL. We continue to grow in numbers and aim to compete for and win an MCLA championship."
https://now.calpoly.edu/organization/slocore,Cal Poly Men's Ultimate Club,"SLOCORE is the official Ultimate Frisbee team of Cal Poly, San Luis Obispo. Founded in 1978, it has represented the school in local and national competitions with men's and women's teams."
https://now.calpoly.edu/organization/merge,Cal Poly MERGE Contemporary Dance Club,Recreational dance club that focuses on contemporary and jazz-based styles.
https://now.calpoly.edu/organization/cpdm,Cal Poly Miracle Club,Cal Poly Dance Marathon was established in 2016 under Children's Miracle Network. We fundraise year-round and host a dance marathon event every Spring in San Luis Obispo where all proceeds go to the Cottage Children's Medical Center.
https://now.calpoly.edu/organization/calpolymootcourtclub,Cal Poly Moot Court Club,"Moot Court is a club to practice public speaking, oral and written debate, and critical thinking. Students argue over fictional cases and apply real-world precedents/concepts in front of a panel of judges during competitions with other schools."
https://now.calpoly.edu/organization/musa,Cal Poly Multiracial Students' Association,"A social and cultural club focused on building a community to share, learn about, and celebrate mixed students' perspectives."
https://now.calpoly.edu/organization/mycology,Cal Poly Mycology Club,"A club dedicated to allowing students to learn about the field of mycology. Major activities include foraging trips, mushroom grows, and other research projects. Join our Discord for information: https://discord.gg/yc9AMaWfaf"
https://now.calpoly.edu/organization/nomas,Cal Poly National Organization of Minority Architect Students,"NOMAS is the student branch of the National Organization of Minority Architects (NOMA). NOMA’s purpose is to champion diversity within the design profession by promoting the excellence, community engagement, and professional development of its members."
https://now.calpoly.edu/organization/nursingpaclub,Cal Poly Nursing / PA Club,Give direction to students aiming for either the Nursing or PA profession. The club networks with admission counselors to familiarize students with each type of program offered. We also provide information with relevant job and volunteer opportunities.
https://now.calpoly.edu/organization/calpolyphotoclub,Cal Poly Photography Club,"Cal Poly Photography Club is a casual, low-commitment group that allows students interested in photography of all types to take photos together as well as share their knowledge and love for photography."
https://now.calpoly.edu/organization/calpolypickleballclub,Cal Poly Pickleball Club,The Cal Poly Pickleball Club welcomes players of all skill levels. It offers an inclusive environment to improve your court skills and discover a sport you can enjoy for a lifetime!
https://now.calpoly.edu/organization/predental,Cal Poly Pre-Dental Society,The Cal Poly Pre-Dental Society is a club for students interested in becoming a dentist and looking for a support network for their future dental career.
https://now.calpoly.edu/organization/productmanagementclub,Cal Poly Product Management Club,"Cal Poly PM Club aims to provide a space for students across different disciplines to learn about product management, build a network with peers as well as industry leaders, and immerse themselves at the intersection of business, tech, and design."
https://now.calpoly.edu/organization/psi-chi,Cal Poly Psi Chi Chapter,"Psi Chi is the National Honor Society for psychology students. Psi Chi is a platform for students to form meaningful connections with peers and faculty members, explore career paths, and network within our community and otherwise."
https://now.calpoly.edu/organization/publicpolicy,Cal Poly Public Policy Club,"The MPP Club is a student-led platform designed for Master’s in Public Policy students, fostering rich discussions, professional development, and practical policy application through workshops, networking events, and community outreach."
https://now.calpoly.edu/organization/calpolyquantclub,Cal Poly Quantitative Finance Club,"An organization dedicated to educating students about the field of quantitative finance, including member led presentations, seminars lead by industry professionals, and hands on group projects."
https://now.calpoly.edu/organization/cpre,Cal Poly Real Estate Club,Club exposes students at Cal Poly to the many different facets of within the Real Estate industry.
https://now.calpoly.edu/organization/cprcc,Cal Poly Red Cross Club,"The Cal Poly Red Cross Club strives to extend the humanitarian efforts of the American Red Cross to the Cal Poly and SLO communities. Our certification classes, blood drives, and visits from healthcare professionals promote a safer and healthier campus."
https://now.calpoly.edu/organization/rfid,Cal Poly RFID and IOT Club,"We promote projects and education around RFID and IOT technologies, especially in business applications."
https://now.calpoly.edu/organization/polyroundnet,Cal Poly Roundnet Club,We are the HUB for Spikeball ( the sport of Roundnet ) at Cal Poly SLO! Our goal is to have every person that comes out to club meetings learn and love the game this club is promoting! Follow us for more information on instagram @calpolyspike.
https://now.calpoly.edu/organization/rowing,Cal Poly Rowing Club,Cal Poly Rowing Club aims to provide Mustangs of all experience levels the opportunity to either discover or continue participation in the sport of rowing. CPRC members can expect to row in boats ranging from single sculls all the way to eights.
https://now.calpoly.edu/organization/rugby,Cal Poly Rugby Club,Club Sports Team
https://now.calpoly.edu/organization/cpsalsa,Cal Poly Salsa Club,"Since 2000, the Cal Poly Salsa Club (CPSalsa) has been dedicated to promoting salsa, bachata, and other forms of Afro-Latin social dancing to San Luis Obispo and the rest of the Central Coast. Learn to dance with us, no partner or experience necessary!"
https://now.calpoly.edu/organization/calpolyscholars,Cal Poly Scholars,"The Cal Poly Scholars program seeks to support and retain high-achieving students from California schools, who come from low-income backgrounds, by providing financial, academic, and community resources."
https://now.calpoly.edu/organization/cpsec,Cal Poly Security Education Club,"We are a group of security-oriented individuals who aim to teach and develop our security expertise through weekly talks, hands-on activities and competitions, and interdisciplinary research. Open to all majors, not just computing disciplinaries."
https://now.calpoly.edu/organization/cpsloverwatch,Cal Poly SLOverwatch Club,SLOverwatch is a club connected to the overall Esports community on campus. We are a welcoming environment for both casual and competitive players of the video game Overwatch 2. Our primary purpose is to provide fun events and to make friends!
https://now.calpoly.edu/organization/cp_sociologyclub,Cal Poly Sociology Club,"The organization will provide sociology students with support within their major, connections with the department and local organizations, and help students find their niche within the sociological field."
https://now.calpoly.edu/organization/cpsicc,Cal Poly South Indian Cultural Club,"A space to celebrate, preserve, and empower the South Indian culture and diaspora."
https://now.calpoly.edu/organization/svdc,Cal Poly Student Veterans and Dependents Club,A club for military connected students that builds community and provides resources.
https://now.calpoly.edu/organization/surfrider,Cal Poly Surfrider Foundation,"We are a student chapter of Surfrider Foundation, a national non-profit organization dedicated to the protection and enjoyment of the world's oceans, beaches, and waves for all. We have many programs that focus on education and advocacy for our coastline"
https://now.calpoly.edu/organization/survivor,Cal Poly Survivor Club,"Our club creates an opportunity for Cal Poly students to meet new people while competing in an exciting strategic game based on the hit CBS TV show Survivor. If you don't want to play, you can also join a welcoming community of all reality TV lovers."
https://now.calpoly.edu/organization/calpolyswimclub,Cal Poly Swim Club,"From beginners to former NCAA Division I swimmers, Swim Club is a fun and competitive club that offers training for swimmers of all abilities. We are a part of CISCA and CCS."
https://now.calpoly.edu/organization/cpswing,Cal Poly Swing Club,"We are a group of dancers who love Lindy Hop, Charleston, Collegiate Shag, Balboa, and various other varieties of swing. All levels welcome! We have free lessons on Sundays from 1-3pm, dance at Madonna Inn every Monday from 8-10pm, and dance around SLO!"
https://now.calpoly.edu/organization/table-tennis,Cal Poly Table Tennis Club,"Cal Poly Table Tennis is a group of students interested in developing their skills in table tennis in an encouraging, supportive environment. We welcome all ability levels and also offer the opportunity for competitive and recreational play."
https://now.calpoly.edu/organization/calpolytaga,Cal Poly TAGA Club,"Cal Poly TAGA, or Technical Association of the Graphic Arts, is a hands-on, competitive Graphic Communication club that focuses on designing and producing a technical research journal and introducing students to the graphics for printing industry."
https://now.calpoly.edu/organization/calpolytechsales,Cal Poly Tech Sales Club,"We are Cal Poly's new B2B software sales club, (tech sales). We want to give students, specifically any students the opportunity to learn more and get involved in SAAS sales. Our focus is to help students become BDRs, SDRs, and Account Executives."
https://now.calpoly.edu/organization/tec,Cal Poly Textile Engineering Club,"The goal of Cal Poly's Textile Engineering club is to represent synthetic materials in engineering and provide opportunities to develop our own textiles. Students aim to establish connections with industries that work with polymers, fibers, and plastics."
https://now.calpoly.edu/organization/theisms,Cal Poly Theisms Club,"We promote open-minded and thoughtful reflection upon issues important to Religious Studies with activities, speakers, and other programs."
https://now.calpoly.edu/organization/unicycle,Cal Poly Unicycle Club,"The Cal Poly Unicycle Club exists to teach anyone interested how to ride a unicycle for the first time, and also level up skills of existing riders. We hope to promote the sport of unicycling within our campus community in a safe and fun environment."
https://now.calpoly.edu/organization/cpurbanists,Cal Poly Urbanists Club,We are looking to promote the real world application of planning principles in order to empower Cal Poly students to enact the change they wish to seek on campus and in SLO through activism and community engagement.
https://now.calpoly.edu/organization/valorant,Cal Poly Valorant Club,The one-stop for Valorant on campus. We welcome Casual and Competitive Valorant players!
https://now.calpoly.edu/organization/vanlifeclub,Cal Poly Van Life Club,"A Van Life/ Tiny-House based club with a focus on travel, recreation & alternative living. Members also discuss DIY camper conversions. Ownership of a vehicle is not required to participate and all are welcome!"
https://now.calpoly.edu/organization/water-ski,Cal Poly Water Ski Team,"The Cal Poly Water Ski team promotes the sport of competitive Water Skiing up and down the West Coast and on National levels. We provide students of all skill levels with access to practice and coaching in slalom, trick, and jump events."
https://now.calpoly.edu/organization/cpwomeninbusiness,Cal Poly Women in Business Association,"Founded in Spring 2015, the Cal Poly Women in Business Association was created to act as a resource and community for young women, working to provide students with the skills and network needed to succeed in college and life."
https://now.calpoly.edu/organization/womensclubbaseball,Cal Poly Women's Club Baseball,We are a club baseball team that gives women an opportunity to play and learn baseball and compete in games and tournaments against women's club teams at other colleges. We want to grow the community of women in this sport and build a community.
https://now.calpoly.edu/organization/cpwcvb,Cal Poly Women's Club Volleyball,Cal Poly Women's Club Volleyball offers intercollegiate competition at the club volleyball level.
https://now.calpoly.edu/organization/cpwp-womens,Cal Poly Women's Club Water Polo,The Cal Poly Club Women's Water polo team is a group of athletes that compete at tournaments in the Pacific Coast Division of the Collegiate Water Polo Association. We are an inclusive team that collectively shares the love for the game.
https://now.calpoly.edu/organization/calpolywlax,Cal Poly Women's Lacrosse Team,"Home of the 7-time National Champions, Cal Poly Women's Lacrosse competes in Division I & Division II of the Western Women's Lacrosse League as we play various teams throughout California."
https://now.calpoly.edu/organization/wrestling,Cal Poly Wrestling Club,Provides an opportunity for students to begin or continue their wrestling career and stay involved in the wrestling community
https://now.calpoly.edu/organization/calpolyyogaclub,Cal Poly Yoga Club,"Cal Poly Yoga Club is a recreational organization that provides a safe and inclusive space for students to learn, practice, and enjoy yoga and acro yoga together. It is free. No partner, experience or equipment is needed. @calpoly.yogaclub on instagram"
https://now.calpoly.edu/organization/yu-gi-oh,Cal Poly Yu-Gi-Oh! Club,Cal Poly Yu-Gi-Oh! Club strives to create a friendly atmosphere for those interested in learning or playing the game Yu-Gi-Oh!
https://now.calpoly.edu/organization/cpwc,"California Polytechnic State University, San Luis Obispo Student Chapter of The Wildlife Society",Wildlife Club is a student chapter of The Wildlife Society and provides students interested in a career in wildlife with networking opportunities and workshops. We meet every Thursday at 11am.
https://now.calpoly.edu/organization/camellia,Camellia Club,"The Camellia Club has been formed to create a welcoming environment for all students of all years and majors to relax, get to know each other and make connections."
https://now.calpoly.edu/organization/camp-polyhacks,Camp PolyHacks,Camp PolyHacks organizes an annual hackathon that brings together interdisciplinary students in building community and social entrepreneurship.
https://now.calpoly.edu/organization/chw,Campus Health & Wellbeing,Campus Health Wellbeing
https://now.calpoly.edu/organization/cpcc,Can of Worms Comedy Club,"Can of Worms Comedy Club is the club for you if you want to venture out into the dazzling world of stand-up comedy! Whether you like to watch or perform stand-up comedy Can of Worms has open mics, themed nights, workshops, and showcases all year round!"
https://now.calpoly.edu/organization/careerservices,Career Services,"Career Services empowers students to achieve a lifetime of meaningful career success by engaging with Cal Poly's vibrant network. We'll help you explore career possibilities, and provide guidance and resources to jump-start your career planning!"
https://now.calpoly.edu/organization/leadership,Center for Leadership,"The Center for Leadership fosters socially responsible leadership development through high impact practices, programs, and events. The center fosters personal growth, determination and self-awareness while providing guidance and inspiration."
https://now.calpoly.edu/organization/serviceinaction,Center for Service in Action,"The Center for Service in Action at Cal Poly empowers students to take action and address community needs through service, volunteering, and activism."
https://now.calpoly.edu/organization/chabad,Chabad Student Group,"Chabad Student Group of Cal Poly is a Jewish organization that provides students with a ''home away from home''. Chabad is dedicated to increasing the awareness, knowledge and tradition of Judaism in the Central Coast"
https://now.calpoly.edu/organization/chidelts,"Chi Delta Theta Sorority, Incorporated","Chi Delta Theta strives to promote siblinghood, academics, community service, cultural awareness, and social activity in the lives of its members."
https://now.calpoly.edu/organization/xe,Chi Epsilon Honor Society,"Chi Epsilon is the National Civil Engineering Honor Society in the United States. We honor students who have exemplified the principles of ""Scholarship, Character, Practicality, and Sociability"" in the civil and environmental engineering profession."
https://now.calpoly.edu/organization/alpha-omicron-pi,Chi Psi Chapter of Alpha Omicron Pi,"The object of the Fraternity shall be to encourage a spirit of Fraternity and love among its members; to stand at all times for character, dignity, scholarship, and college loyalty."
https://now.calpoly.edu/organization/calpolypsi,Chi Sigma chapter of Phi Sigma Iota,"Cal Poly PSI is a chapter of Phi Sigma Iota, the highest international linguistics honor society. It recognizes outstanding accomplishment in the study or teaching of academics related to foreign language, literature, and culture."
https://now.calpoly.edu/organization/csa,Chinese Students' Association,"CSA is a social-cultural club that strives to bring people together through social events and celebrates Chinese culture, but most importantly our mission is to create an inclusive and friendly community."
https://now.calpoly.edu/organization/christian-students,Christian Students,"We are a group of believers who love the Lord and want to meet with others who pursue Him, regardless of their background."
https://now.calpoly.edu/organization/club34,Club 34,"Club 34 is Cal Poly's social art club. We aim to build a community of interdisciplinary creatives by hosting a handful of social events each quarter which may include student-run shows, craft nights, artist talks, and movie nights."
https://now.calpoly.edu/organization/tennis,Club Tennis,"Club Tennis is a co-ed team whose goal is to allow players of all skill levels to continue their tennis careers at Cal Poly, and to develop a tight-knit group in the process. Our competitive team travels monthly to compete with teams across the nation."
https://now.calpoly.edu/organization/americorps,College Corps Service Opportunities,Are you a College Corps fellow interested in doing some service outside of your primary host site? You're in the right place! Check out some fun supplemental service opportunities below.
https://now.calpoly.edu/organization/cafescouncil,"College of Agriculture, Food, and Environmental Sciences Student Council",College of Agriculture Food and Environmental Sciences has one representative from each club to come together for a meeting every Tuesday to talk about different events going on in our college.
https://now.calpoly.edu/organization/cac,Colleges Against Cancer,"We are a club that plans the annual Cal Poly Relay for Life, a large-scale fundraiser to benefit the American Cancer Society."
https://now.calpoly.edu/organization/color-coded,Color Coded,"Founded in 2018, ""Color Coded: Diversity in Tech"" is a student-led organization aiming to promote the professional and academic success of underrepresented students in the technology industry."
https://now.calpoly.edu/organization/cessa,Comparative Ethnic Studies Student Association,Comparative Ethnic Studies Student Association''s purpose is to provide a place to supplement the educational and networking experiences of students with an interest in Comparative Ethnic Studies.
https://now.calpoly.edu/organization/csai,Computer Science and Artificial Intelligence,CSAI brings students together to tackle meaningful problems using artificial intelligence.
https://now.calpoly.edu/organization/computingclubcollaborative,Computing Club Collaborative,Leaders from computing organizations on campus come together to create immersive events for Cal Poly students!
https://now.calpoly.edu/organization/crs,Computing Research Society,"Our club offers a space to conduct hands-on research, collaborative projects, and literature discussions in computing. Members present findings, fostering skills and a deeper understanding of research methodologies"
https://now.calpoly.edu/organization/core,CORE,"Core is a pre-WOW program rooted in proactively connecting underrepresented students to the resources, community, and connections that will kickstart their leadership journey at Cal Poly instilling confidence in their ability to navigate their WoW."
https://now.calpoly.edu/organization/cldc,Country Line Dancing Club,"The Country Line Dancing Club provides engaging, interactive line and partner dancing instruction to students and offers a safe environment for members to learn everything they need to know about country line dancing."
https://now.calpoly.edu/organization/cp-drag,Cal Poly Drag Club,Cal Poly Drag Club was founded as a way to give on campus queer artists and enthusiasts a way to explore and embrace themselves.
https://now.calpoly.edu/organization/slocru,Cru,"Cru Central Coast is a part of Cru, an interdenominational, worldwide Christian ministry with the goal of giving every student the opportunity to hear and respond to the Good News of Jesus Christ."
https://now.calpoly.edu/organization/delight-ministries,Delight Ministries at Cal Poly,Delight is a club inviting college women on the central coast into Christ-centered community that fosters vulnerability and transforms stories.
https://now.calpoly.edu/organization/deltachi,Delta Chi,"Delta Chi is a campus-affiliated Greek Fraternity. We strive to benefit the lives and characters of each and every one of our members. We foster a unique brotherhood centered around loyalty, compassion, & gentlemanly conduct."
https://now.calpoly.edu/organization/dsp,Delta Sigma Phi - Epsilon Rho Chapter,"Delta Sigma Phi's mission is ""Building Better Men"". The ""Better Man"" is defined as a man of courage, a man of action, and a man of excellence. Members of Delta Sigma Phi value culture, harmony, and friendship."
https://now.calpoly.edu/organization/deltasig,Delta Sigma Pi Kappa Mu Chapter,Delta Sigma Pi is a professional fraternity organized to foster the study of business in universities and promote closer affiliation between the commercial world & students of commerce.
https://now.calpoly.edu/organization/delta-upsilon,Delta Upsilon,Cal Poly affiliated fraternity chapter that strives to bring philanthropy and volunteer service to the Cal Poly campus and surrounding SLO community
https://now.calpoly.edu/organization/designlab,Design Lab,"Design Lab provides a space for designers and professionals to connect, collaborate on projects, and learn more about each other and the industry."
