tablescraper-selected-row href,Club Name,Description Excerpt
https://now.calpoly.edu/organization/aacfclub,AACF (Asian American Christian Fellowship),"The mission of AACF is to reach into the university and collegiate community with the life-changing message of Jesus Christ. We focus on loving God and loving others through community, Bible study, prayer, worship and more!"
https://now.calpoly.edu/organization/cpad,Advertising Club,The Cal Poly Advertising Club provides students with hands-on experience in the world of advertising by partnering with local businesses to create real-world campaigns. Members will boost their creativity through collaboration and passion in the club.
https://now.calpoly.edu/organization/abm-nama,Agribusiness Management/National Agri-Marketing Association Club,"The ABM/NAMA club is a great way for students to learn about and/or prepare for a future in the agribusiness industry. The club allows students to attend industry conventions, compete in marketing competitions, and network with agribusiness professionals"
https://now.calpoly.edu/organization/agricultural-communicators-tomorrow,Agricultural Communicators of Tomorrow,This club provides students the opportunity to become involved in the agricultural industry and be able to bridge the gap between the general public and those involved in agriculture.
https://now.calpoly.edu/organization/ag-eng-society,Agricultural Engineering Society,Main goals of AES are to enhance the student experience associated in the BRAE department as well as other departments throughout campus.
https://now.calpoly.edu/organization/agls,Agricultural Leadership Society,"Agricultural Leadership Society empowers all students to find leadership in agriculture through growing our connections on and off campus, discovering our strengths, and being fun and inclusive at our club events."
https://now.calpoly.edu/organization/ashrae,"American Society of Heating, Refrigerating and Air-Conditioning Engineers","The Cal Poly Chapter of ASHRAE (American Society of Heating, Refrigerating and Air-Conditioning Engineers) helps students better understand the possibilities within the HVAC industry."
https://now.calpoly.edu/organization/axs,"Alpha Chi Sigma, Gamma Zeta Chapter","Alpha Chi Sigma is a co-ed, professional chemistry fraternity committed to creating a positive environment where students and faculty interested in the chemical sciences can become involved in service and leadership."
https://now.calpoly.edu/organization/akdphi,alpha Kappa Delta Phi,"alpha Kappa Delta Phi is the largest and only international Asian-Interest sorority with over 65 chapters across the U.S. & Canada. Our 5 pillars in which we strive towards are Sxsterhood, Scholarship, Leadership, Service, and Asian-Awareness."
https://now.calpoly.edu/organization/akpsi,Alpha Kappa Psi Professional Business Fraternity,Alpha Kappa Psi is a Co-Ed Professional Business Fraternity opened to all majors.
https://now.calpoly.edu/organization/cpaoe,Alpha Omega Epsilon,Alpha Omega Epsilon is a professional and social sorority composed of engineering and technical science students and alumni from across the globe.
https://now.calpoly.edu/organization/aphio,"Alpha Phi Omega, Zeta Omicron Chapter","We are a co-ed national service fraternity, so our main goal is to do community service. Other than service, we also have fellowship events, interchapter events, alumni events, and more."
https://now.calpoly.edu/organization/apm,Alpha Pi Mu at Cal Poly,We are the national honor society for Industrial Engineering students. We recognize the leaders in our department and give back to our community on and off campus.
https://now.calpoly.edu/organization/asmu,Alpha Sigma Mu,Honors organization for the Materials Engineering Department.
https://now.calpoly.edu/organization/alpha-sigma-phi,Alpha Sigma Phi Iota Chi (ΑΣΦ IX),"The purpose of Alpha Sigma Phi is to Better the Man through the creation and perpetuation of brotherhood founded upon the values of character: Silence, Charity, Purity, Honor, Patriotism."
https://now.calpoly.edu/organization/ata,Alpha Tau Alpha,Alpha Tau Alpha is a professional fraternity for current and future agriculture teachers.
https://now.calpoly.edu/organization/acs,American Chemical Society,The American Chemical Society (ACS) is the registered Cal Poly SLO chapter of the national organization of the same name and provides those interested in chemistry with a place to foster friendships and gain professional knowledge in the field.
https://now.calpoly.edu/organization/aisa,American Indian Students Association,The American Indian Students Association (AISA) strives to create an inclusive environment and welcoming community for anyone who identifies as 'indigenous' or wants to be an ally for indigenous students on Cal Poly's campus.
https://now.calpoly.edu/organization/aiaa,American Institute of Aeronautics and Astronautics,We host speakers from the industry once or twice a month to share about different opportunities within the field or lecture on interesting subjects within the aerospace industry.
https://now.calpoly.edu/organization/aias,American Institute of Architecture Students,"The AIAS is the country's largest organization for students of architecture, providing the best programs, information and resources available. The AIAS is the student affiliate of the AIA and your link to professionals in architecture."
https://now.calpoly.edu/organization/ama,American Marketing Association,The American Marketing Association aims to provide students interested in the fields of marketing and sales with the tools and tips needed to create a successful career and future.
https://now.calpoly.edu/organization/sloaslclub,American Sign Language Club,A group dedicated to learning American Sign Language and Deaf culture.
https://now.calpoly.edu/organization/scasla,"American Society of Landscape Architecture, Student Chapter","This organization helps students pursuing landscape architecture to learn more about the field, build connections, and engage in educational and professional events."
https://now.calpoly.edu/organization/adl,Analogue Design Lab,"Analogue Design Lab designs and produces products for competitions, design challenges, and based on student interests. If you're seeking to make an idea reality or just want to learn more about engineering design, ADL is for you!"
https://now.calpoly.edu/organization/argentineculturalsocietycp,Argentine Cultural Society at Cal Poly,"Organize and host events such as mate gatherings, asados (barbecue cookouts), and alfajor-making workshops, providing authentic spaces where members can enjoy traditional Argentine food and customs together."
https://now.calpoly.edu/organization/asa,Armenian Students Association,"A cultural club aimed to unite, educate, and foster a social environment for students of Armenian heritage."
https://now.calpoly.edu/organization/a3,Asexual Association,"A social club for aromantics, asexuals, and allies to connect and build community."
https://now.calpoly.edu/organization/agc,Associated General Contractors,"We are a student chapter of a national organization for construction companies & vendors, the AGC. We offer a unique point of view on the construction industry as well as access to these companies for professional development and networking."
https://now.calpoly.edu/organization/calpolyasp,Associated Students in Planning,Cal Poly ASP is a professional club for CRP (City and Regional Planning) majors and non-majors to enhance their academic careers by helping to expose them to the City Planning profession. Meetings are weekly. Please contact calpolyasp@gmail.com for more.
https://now.calpoly.edu/organization/ascm,Associated Students of Construction Management,"ASCM offers students the opportunity to learn and be involved in the construction management profession, to network and develop relationships with potential employers, and meet fellow students. The student chapter upholds the ideals and standards of"
https://now.calpoly.edu/organization/asi,"Associated Students, Inc. (ASI)",Connecting students to their ultimate college experience.
https://now.calpoly.edu/organization/ampp,Association for Materials Protection and Performance - Cal Poly Chapter,"The AMPP California Central Coast student chapter is a group of hardworking students looking outside the classroom to expand their education and make lifelong connections by hosting industry talks, performing meaningful experiments, and outreach."
https://now.calpoly.edu/organization/awm,Association for Women in Mathematics - Cal Poly Student Chapter,A society that aims to support women and minorities in mathematics and to influence the culture of mathematics as a whole.
https://now.calpoly.edu/organization/aep,Association of Environmental Professionals,"The Cal Poly Student Chapter of Association of Environmental Professionals promotes networking and professional development in the field of natural resources management in order to enhance, maintain, and protect the natural and human environment."
https://now.calpoly.edu/organization/ats,Association of Transfer Students,The Association of Transfer Students (ATS) is a social club designed to help transfers build community and make their transition to our campus as fun and easy as possible.
https://now.calpoly.edu/organization/aws-cloud-club-at-cal-poly,AWS Cloud Club Cal Poly,"AWS Cloud Club teaches students about AWS Cloud and its use cases, including those related to security, AW, business analytics, business transformation, etc. Gives students hands-on experience through projects in the AWS Cloud, providing industry skills."
https://now.calpoly.edu/organization/waterworks,AWWA Cal Poly San Luis Obispo,"Cal Poly WaterWorks aims to enhance students' understanding of water resource engineering, planning, and management."
https://now.calpoly.edu/organization/badminton,Badminton Club,"Join us if you love badminton! All skills levels welcome, proud member of SCCBL (Southern California Collegiate Badminton League)."
https://now.calpoly.edu/organization/bahai,Baha'i Club at Cal Poly,"The second most geographically widespread religion in the world, the Bahá'í Faith emphasizes unity, peace, and the fundamental oneness of God, oneness of religion, and the oneness of mankind."
https://now.calpoly.edu/organization/bestbuddies,Best Buddies,Best Buddies is an organization that is dedicated to establishing a global volunteer movement that creates opportunities for individuals with intellectual & developmental disabilities.
https://now.calpoly.edu/organization/aephi,"Beta Lambda Chapter of Alpha Epsilon Phi Sorority, Incorporated","Alpha Epsilon Phi is a sorority that fosters lifelong friendship and sisterhood, academics, social involvement, and community service, all the while providing a home away from home for its members."
https://now.calpoly.edu/organization/bmes,Biomedical Engineering Society,"BMES is dedicated to enriching the biomedical engineering student experience by providing an inclusive environment for students to build relationships, explore the field of biomedical engineering, & gain professional skills"
https://now.calpoly.edu/organization/biotech,Biotechnology Club,"The Biotechnology Club provides opportunities for students to gain a better understanding of the field of biotechnology, learn more about career paths in biotech, and gain valuable connections through club events."
https://now.calpoly.edu/organization/baeccommunity,Black Academic Excellence Center (BAEC),"Uplifting the Black student experience, our program unites the Black diaspora by nurturing growth through our shared experiences, along with educational, and social engagements that produce joy and unity. Register for this quarter’s events in our profile"
https://now.calpoly.edu/organization/calpolybsu,Black Student Union,A club for black students and their allies to engage in fun and educational social activities.
https://now.calpoly.edu/organization/blockchain,Blockchain at Cal Poly,"Blockchain at Cal Poly is an education, research, and development platform teaching student and faculty about the applications of blockchain technology and how to develop decentralized applications."
https://now.calpoly.edu/organization/bgsm,BMED Graduate Student Club,"The BMED Graduate Students Club at Cal Poly fosters community among masters level biomedical engineering students, providing a space for socializing and professional development."
https://now.calpoly.edu/organization/bursa,Burmese Student Association,"Burmese Student Association at Cal Poly SLO is a cultural/social club for creating a sense of community among its members and representing Burmese culture on campus through the celebration of Burmese food, events, and major holidays."
https://now.calpoly.edu/organization/caed-dei,"CAED Diversity, Equity, and Inclusion Club","The CAED DEI Club seeks to improve and advocate for the academic, social, and professional circumstances of underrepresented and minority students within CAED as a way of increasing representation and active participation in college affairs."
https://now.calpoly.edu/organization/calpoly3daircraft,Cal Poly 3D Printed Aircraft Club,Our club is dedicated to researching and constructing the next generation of 3D printed RC aircraft for both competition and materials research.
https://now.calpoly.edu/organization/cpac,Cal Poly Accounting Club,CPAC helps students develop professionally and connect with job opportunities in the accounting profession. CPAC creates a community of students and professionals who give back and help students progress into their careers.
https://now.calpoly.edu/organization/alpineclub,Cal Poly Alpine Club,"Cal Poly Alpine Club is designed to facilitate safe travel through the backcountry by providing gear, partners, weather assessments, and educational resources."
https://now.calpoly.edu/organization/cparc,Cal Poly Amateur Radio Club,"A club devoted to the application of amateur radio, the use of the radio frequency spectrum for noncommercial purposes including experimentation, public service, radio communication, and emergency communication."
https://now.calpoly.edu/organization/amsa,Cal Poly American Medical Student Association,AMSA is a pre-medical club focused on preparing students for a career in healthcare. We act as a valuable source of information and provide opportunities and experiences in order to help students thrive in their preparation for medical school.
https://now.calpoly.edu/organization/calpolyandaaz,Cal Poly Andaaz Club,Cal Poly Andaaz is SLO's first competitive Co-ed Film Song Dance Team. Our music especially comes from Indian films mixed with various western pop music.
https://now.calpoly.edu/organization/animation,Cal Poly Animation Club,"The Cal Poly Animation Club is creating animated short films while hosting guest speakers, workshops and tours."
https://now.calpoly.edu/organization/calpolyarchaeology,Cal Poly Archaeology Club,The Cal Poly Archaeology Club aims to promote knowledge of the archaeological discipline and provide a network for members to connect with both professionals and their peers.
https://now.calpoly.edu/organization/archery,Cal Poly Archery Club,The Archery Club focuses on developing an individual's archery shooting skills. The club focuses on recreational archery for both beginners and experts.
https://now.calpoly.edu/organization/cpas,Cal Poly Astronomical Society,"The Cal Poly Astro Society welcomes all who have a passion for space, no prior experience necessary. Throughout the year, we organize stargazing events, guest speakers, and quarterly camping trips. Hope to see you all on our next astronomical adventures!"
https://now.calpoly.edu/organization/aes,Cal Poly Audio Engineering Society,"The Audio Engineering Society provides education in engineering audio gear including speakers, mixers, amplifiers, pedals, microphones, and more!"
https://now.calpoly.edu/organization/website,Cal Poly Ballroom Dance Club,"Ballroom dancing encompasses a wide variety of partner dances. The basic 6 dances in ballroom dancing are Waltz, Foxtrot, Tango, Cha Cha, Rumba, and East Coast Swing, although there are many more. No experience or partner required!"
https://now.calpoly.edu/organization/barbell,Cal Poly Barbell Club,"Previously the Cal Poly Powerlifting Club, we have expanded our focus to all strength-training athletes! We have created an uplifting fitness community that prioritizes mindful training while still having a team-focused bond."
https://now.calpoly.edu/organization/bowling,Cal Poly Bowling Club,We are a competitive bowling team that travels within the west coast region to numerous collegiate bowling tournaments.
https://now.calpoly.edu/organization/calpolycalgeo,Cal Poly CalGeo Club,The goal of Cal Poly CalGeo is to propagate and preserve the interest of Geotechnical Engineering among Cal Poly students & to provide our members with academic and professional connections to ensure their success.
https://now.calpoly.edu/organization/chaarg,Cal Poly CHAARG,"CHAARG is an acronym that stands for *Changing Health, Attitudes, + Actions to Recreate Girls*. We are a community seeking to make fitness fun + support others who want to live a healthy + happy life."
https://now.calpoly.edu/organization/cccp,Cal Poly Chess Club,This club is to promote and help people learn chess.
https://now.calpoly.edu/organization/classics,Cal Poly Classical Literature Book Club,"The Cal Poly Classical Literature Club is a discussion-based club aiming to help members reach a better understanding of modern art, language, and media through reading classics."
https://now.calpoly.edu/organization/climbingclub,Cal Poly Climbing Club,The Cal Poly Climbing Club functions as an organization that supports social events that allow fellow climbers to meet one another and climb together. We also support a competition team that competes through USA Climbing as a recognized collegiate team.
https://now.calpoly.edu/organization/baseball,Cal Poly Club Baseball,Club baseball team that is a member of the National Club Baseball Association (NCBA) and competes in the Sothern Pacific - West Conference. The club typically consists of a 26-32 player roster.
https://now.calpoly.edu/organization/field-hockey,Cal Poly Club Field Hockey,"In the fall, we play other college field hockey club teams and, compete in tournaments such as Cal Cup in the spring. We consist of around 35 members who loving playing field hockey and being in a team environment."
https://now.calpoly.edu/organization/cognitiveneuroscienceclub,Cognitive Neuroscience Club,A club dedicated to providing students with opportunities to learn about cognitive neuroscience and expand their social and professional networks in the field.
https://now.calpoly.edu/organization/cpcr,Cal Poly College Republican Club,"A community of Conservatives united around the ideas of individual freedom, free speech, a strong national defense, free enterprise, and traditional values."
https://now.calpoly.edu/organization/calpolycomsclub,Cal Poly Communication Studies Club,"Cal Poly COMS Club is a dynamic organization designed for students who are interested in understanding the communication field with a focus on academic, professional, and social experiences."
https://now.calpoly.edu/organization/cpesociety,Cal Poly Computer Engineering Society,We are a social and educational community for the Computer Engineering (as well as all computing) majors of Cal Poly! We are a student-run society whose primary goal is to help students succeed in their major and get a jump-start into the workforce.
https://now.calpoly.edu/organization/consulting-club,Cal Poly Consulting Club,Cal Poly Consulting Club (CPCC) focuses on raising awareness about the consulting industry and establishing active connections between students and firms.
https://now.calpoly.edu/organization/calpolysanluisobispocopticclub,Cal Poly Coptic Club,"We are a student-run organization that provides a community for undergraduate students within the Coptic Orthodox Christian faith. We provide prayer meetings, bible studies, church services, service projects, and fun social events."
https://now.calpoly.edu/organization/counter-strike,Cal Poly Counter-Strike Club,"CPCS is Cal Poly's hub for all things Counter-Strike. We provide a community for all players, both casual and competitive! Join our discord for more info! https://discord.gg/PkPnZWmWAA"
https://now.calpoly.edu/organization/mustangcricket,Cal Poly Cricket Club,"Mustang Cricket is a student organization dedicated to promoting cricket on campus. We provide equipment, facilities, and instruction to make cricket accessible to all students, regardless of prior experience."
https://now.calpoly.edu/organization/cpcropsclub,Cal Poly Crops Club,We are a social club in the CAFES department involved in connecting our students to industry professionals within the agriculture sector.
https://now.calpoly.edu/organization/cycling,Cal Poly Cycling Team,The Cal Poly Cycling Team is a community of like-minded individuals who embrace the love of two-wheeled adventures.
https://now.calpoly.edu/organization/calpolydatascience,Cal Poly Data Science Club,"Cal Poly Data Science hopes to be an organization for those pursuing the data science minor or anyone interested in the field. We hold monthly meetings, workshops, alumni panels, and more to increase the exposure and knowledge of data science."
https://now.calpoly.edu/organization/cpslodems,Cal Poly Democrats Club,"Our mission is promote discourse, inclusivity, and engagement with the political process. Our club meetings are an educational space for students to learn more about politics at a local and national level."
https://now.calpoly.edu/organization/disc-golf,Cal Poly Disc Golf Club,Cal Poly Disc Golf Club is a student organization that strives to grow the sport of disc golf in our community. Our club plays in tournaments across California and practices a couple days a week.
https://now.calpoly.edu/organization/distance,Cal Poly Distance Club,CPDC welcomes all competitive and recreational runners. We strive to provide an opportunity for runners to compete in college outside of the NCAA and a friendly environment for those looking to make friends and run.
https://now.calpoly.edu/organization/slo-ducks,Cal Poly Ducks Unlimited Club,This club will supply a gateway for students to become involved with wetland management and waterfowl conservation. The club will also volunteer for Ducks Unlimited to help put on dinners and raffles to support wetland conservation nationwide
https://now.calpoly.edu/organization/cpes,Cal Poly Economics Society,Cal Poly Economics Society was created to provide a forum for intellectually curious students to discuss and learn about economics topics and current events.
https://now.calpoly.edu/organization/cpe,Cal Poly Entrepreneurs,CPE is a thriving student entrepreneurial community on campus that brings together creative thinkers and doers to build world-changing ideas. Join us Tuesdays 6-7 pm in the Nash Innovation Lab.
https://now.calpoly.edu/organization/fencing,Cal Poly Fencing Club,Sport fencing club for all Cal Poly students. We hold practices twice a week and attend at least one tournament a quarter. No experience or personal gear necessary to join.
https://now.calpoly.edu/organization/yarn,Cal Poly Fiber Arts Club,"Do you like to crochet, knit, sew, or embroider? Or are you interested in learning how? Come join the Cal Poly Fiber Arts Club where any skill level is welcome!"
https://now.calpoly.edu/organization/field-studies,Cal Poly Field Studies Club,"Cal Poly Field Studies organizes and plans camping trips filled with an adventure across the west coast to build a community, foster friendships, and learn about the surrounding areas."
https://now.calpoly.edu/organization/fgc,Cal Poly Fighting Game Club,"A general fighting game community encompassing traditional fighters, platform fighters, etc."
https://now.calpoly.edu/organization/cinemaclub,Cal Poly Film Club,Cal Poly Cinema Club offers a great opportunity to meet and connect with fellow students who share an interest in films & filmmaking. We hold weekly film screenings on campus and the club is open to all interest levels.
https://now.calpoly.edu/organization/calpolyfoodrecovery,Cal Poly Food Recovery Network Club,Cal Poly's chapter of the Food Recovery Network aims to give back to the community by combating food insecurity that exists within San Luis Obispo by reducing food waste that harms our environment and further contributes to climate change.
https://now.calpoly.edu/organization/fdc,Cal Poly Furniture Design Club,"Cal Poly Furniture Design Club is a place where you can explore your passion for furniture. Every quarter we will design and build a set. So whether you want to design it, build it, or just talk about it there is a place for you at FDC."
https://now.calpoly.edu/organization/cpgd,Cal Poly Game Development Club,Our club exists to teach people about the various aspects of game development in a welcoming and accessible way. We also host a game jam every quarter.
https://now.calpoly.edu/organization/calpolygeography,Cal Poly Geography Club,"Cal Poly Geography Club is a club open to everyone with interests in our world, the environment, geopolitics, GIS, map-making, and anything related to geography!"
https://now.calpoly.edu/organization/calpolyinvesting,Cal Poly Investing Club,Cal Poly Investing was founded to give Cal Poly students of all years and majors a place to learn about and discuss investing of all kinds.
https://now.calpoly.edu/organization/na,Cal Poly Investment Banking Club,Cal Poly Investment Banking’s mission is to provide students with the resources necessary to attain an internship or job in investment banking.
