tablescraper-selected-row href,Club Name,Description Excerpt
https://now.calpoly.edu/organization/calpolydesignvillage,Design Village,Design Village is a student-run organization that hosts annual design-build competitions under the direct sponsorship of Cal Poly's CAED. Competitors across the country compete alongside Cal Poly students to claim winner of the year's theme.
https://now.calpoly.edu/organization/disability-alliance,Disability Alliance,"The Disability Alliance seeks to develop a supportive and welcoming environment for students of all abilities at Cal Poly by creating community spaces for peer connection and educating on disability history, culture, and activism."
https://now.calpoly.edu/organization/drc,Disability Resource Center,The Disability Resource Center (DRC) cultivates an accessible and inclusive community where students with permanent and temporary disabilities have an equal opportunity to participate in all aspects of campus life.
https://now.calpoly.edu/organization/diversityinclusion,Diversity & Inclusion,"Diversity & Inclusion is a collective of campus resource centers that support and empower students experiencing marginalization, through intersectional advocacy and cultural connections to build a more just and equitable Cal Poly community."
https://now.calpoly.edu/organization/adventurers,Dragon Boating Outreach Club,"We are a Cal Poly club affiliated with the Central Coast Adventurers Dragon Boat team in which students have the opportunity to paddle in Morro Bay in a fun and supportive environment. We provide a chance to see wildlife, build community, and exercise!"
https://now.calpoly.edu/organization/dreamcentercommunity,Dream Center,"Providing holistic support and resources to undocu/DACA students, members of mixed status families, and allies through empowering and educational programming, community building, and campus referrals. Register for this quarter’s events in our profile"
https://now.calpoly.edu/organization/eco-reps,Eco Reps,Eco Reps are committed to creating a culture of environmental stewardship on campus at Cal Poly. Eco Reps exemplify the motto 'Growing Greener Minds' and plays a direct role in Cal Poly's advancement for sustainability.
https://now.calpoly.edu/organization/eop,Educational Opportunity Program (EOP),"Provides admission, academic and financial support services to historically underserved students throughout California."
https://now.calpoly.edu/organization/teachersofcolorlendinglibrary,Educators of Color,"Educators of Color's purpose is to create a space for students of color who are passionate about the educational field from teaching primary, secondary, or post-secondary settings, to working as administrators or as student/academic affairs personnel."
https://now.calpoly.edu/organization/eimclub,EIM Club,"The EIM Club is a student organization that has a primary focus to serve students, whether majors or not, interested in recreation, parks, and tourism administration (RPTA). We provide opportunities in networking, jobs, and local business insights."
https://now.calpoly.edu/organization/endoverdose,End Overdose at Cal Poly,"End Overdose is a 501(c)3 non-profit organization based in Los Angeles, California working to end drug-related overdose deaths through education, medical intervention, and public awareness."
https://now.calpoly.edu/organization/eng-student-council,Engineering Student Council,"The Engineering Student Council serves to bridge the communication gap between engineering students, the College of Engineering, and the University, and provides cohesion and cooperation between the diverse student organizations and clubs within CENG."
https://now.calpoly.edu/organization/globalengineeringawareness,Engineers for Global Cultural Awareness,Engineers for Global Awareness is a space for engineers to learn more about the different engineering practices worldwide.
https://now.calpoly.edu/organization/esc,Environmental Sciences Club,"ESC serves to introduce students who are interested in Environmental Science to potential career paths, community service organizations, and recreational activities related to environmental science and natural resources."
https://now.calpoly.edu/organization/epicmovement,Epic Movement,Epic is an Asian American Christian movement that is focused on bringing the love of Jesus Christ to students at Cal Poly. We seek to become apart of God's redemptive mission to share the Gospel world-wide.
https://now.calpoly.edu/organization/alphaphi,Epsilon Chi Chapter of Alpha Phi International Fraternity Incorporated,"Alpha Phi is a sisterhood of outstanding women supporting one another in lifelong achievement. The sisterhood of Alpha Phi stretches from coast to coast through 164 collegiate campuses and more than 200,000 members."
https://now.calpoly.edu/organization/axo,Epsilon Omega Chapter of Alpha Chi Omega,"Alpha Chi Omega was founded to provide a basis of mutual helpfulness and of congenial fellowship. The purpose of Alpha Chi Omega was to provide the advancement of the intellectual, social and moral culture of its members."
https://now.calpoly.edu/organization/esports,Esports Council,"This Organization is the official voice of the many different esports and gaming clubs that exist on campus in order to promote and champion the needs, interests, and activities of the students who engage with the gaming community at Cal Poly."
https://now.calpoly.edu/organization/hkn,Eta Kappa Nu,Electrical and Computer Engineering Honor Society
https://now.calpoly.edu/organization/phisigslo,Eta Septaton Chapter Phi Sigma Kappa,"The Eta Septaton Chapter of Phi Sigma Kappa is a group of brothers that promotes our three pillars of brotherhood, scholarship, and character in each of our lives."
https://now.calpoly.edu/organization/sigma-pi,Eta-Delta Chapter of Sigma Pi Fraternity,"Eta Delta Chapter of Sigma Pi Fraternity, International"
https://now.calpoly.edu/organization/ersa,External Relations,
https://now.calpoly.edu/organization/fast,"Fashion, Innovation, Trendsetting, and Styling Club","A community for students who are interested in the realm of fashion and learning skills in garment construction, styling, design, modeling, and fashion photography, while integrating the values of sustainable fashion.  Formerly known as FAST"
https://now.calpoly.edu/organization/fma,Financial Management Association,FMA introduces its members to the limitless number of career opportunities in Finance.
https://now.calpoly.edu/organization/food-science,Food Science Club,Food Science Club provides opportunities for food science students to learn about possible opportunities and achievements in the food industry.
https://now.calpoly.edu/organization/flc,French Language Club,"The French Language Club is a group dedicated to speaking and practicing speaking French. All skill levels are welcome. We do social events, like French-themed soirées, but mainly practice conversational french."
https://now.calpoly.edu/organization/fnl,Friday Night Live,"Friday Night Live at Cal Poly is a club on campus that creates fun and free events that promote social, emotional, and physical well-being, while introducing club members to the field of Behavioral Health."
https://now.calpoly.edu/organization/furries,Furries at Cal Poly,"Join an inclusive and passionate community of furries on campus! We organize art workshops, furmeets, convention info sessions, and outreach for everything anthro."
https://now.calpoly.edu/organization/fmec,Future Math Educators Club,"The primary goal of the club is increasing communication, fostering social connections, and the creation and upkeep of a community among students, faculty, and staff at Cal Poly interested in the study of the teaching of mathematics."
https://now.calpoly.edu/organization/slogammaphibeta,"Gamma Phi Beta, Delta Theta Chapter",Panhellenic Sorority
https://now.calpoly.edu/organization/geccommunity,Gender Equity Center (GEC),"Founded by students the Gender Equity Center empowers feminine, transgender, womxn-of-center, other gender-expansive students, and their supporters through expansive and inclusive programing. Register for this quarter’s events in our profile."
https://now.calpoly.edu/organization/cpgig,Gender-Inclusive Gaming,Gender-Inclusive Gaming is a social safe space that supports minorities who are interested in gaming of any variation as a leisure activity!
https://now.calpoly.edu/organization/calpolygg,Genetics and Genomics Club,"A resource group for students who are interested in learning about genetic counseling and the field of genetics. We facilitate discussions, host guests, and practice skills to help each other grow as individuals and as future professionals."
https://now.calpoly.edu/organization/genkey,GenKEY Sound Collective,"GenKEY is a collective of non-audition bands that focus on Japanese Rock, Pop, R&B, Funk, and Jazz. Each band aims to amplify Japanese culture through music both on-campus and off!"
https://now.calpoly.edu/organization/gdsc,Google Developer Student Clubs,Google Developer Student Clubs (GDSC) are university-based community groups for students interested in Google technologies and programming. There are GDSCs in over 110 countries around the world that include undergraduate and graduate students.
https://now.calpoly.edu/organization/gsa,Graduate Student Association,The official representative body of graduate students at Cal Poly
https://now.calpoly.edu/organization/guac,Graduate Unified ARCE Club,This club is for Graduate Students pursuing a career in Structural Engineering with a goal of fostering a community of diverse students in a primarily undergraduate institution. Our club would help foster both professional and social skills.
https://now.calpoly.edu/organization/growcrew,GrowCrew,"To promote the practice, awareness, and access to sustainable and innovative ideas for controlled environment agriculture."
https://now.calpoly.edu/organization/guardianscholars,Guardian Scholars,"Guardian Scholars, Office of Dean of Students"
https://now.calpoly.edu/organization/hack4impact,Hack4Impact,"We are a student-run 501(c)(3) organization that empowers engineers, designers, activists, and humanitarians to create lasting social change by developing projects for local nonprofits. We foster the wider adoption of software as a tool for social good."
https://now.calpoly.edu/organization/hercampuscalpoly,Her Campus at Cal Poly,"We are an online magazine catered to collegiate women but open to all. Joining our magazine is a great way to get real experience in the editorial, media, journalism, marketing, and event planning industry."
https://now.calpoly.edu/organization/cphiking,Hiking and Backpacking Club,We are focused on uniting students from diverse backgrounds through the common love for the outdoors. We do weekly hikes and quarterly backpacking trips.
https://now.calpoly.edu/organization/hillel,Hillel of San Luis Obispo,"San Luis Obispo Hillel is the center-point of Jewish life at Cal Poly and San Luis Obispo Community. We provide a welcoming and supportive environment, so our students can be proud of and engaged with their Judaism."
https://now.calpoly.edu/organization/hindu-yuva,Hindu YUVA,"Hindu YUVA (Youth for Unity, Virtues, and Action) holds meetings and conducts events where we have yoga, discussions, games, celebrate festivals, volunteer with the community, guest lectures about Hinduism, and much more. Everyone is welcome to join!"
https://now.calpoly.edu/organization/horticulture,Horticulture Club,"The purpose of this organization is to allow students interested in horticulture to socialize, learn about plants, grow plants in hands-on settings, and network with industry."
https://now.calpoly.edu/organization/cphuiohawaii,Hui O Hawai'i,Cal Poly Hui ‘O Hawai'i provides a home away from home for students from Hawai'i and a community for all those who are interested in the culture of Hawai'i. We seek to spread aloha through cultural and social events.
https://now.calpoly.edu/organization/hrma,Human Resource Management Club,"The Human Resources & Management Association is open to all majors with a focus on professional development. We want to offer the students at Cal Poly a place to grow and learn about business, Human Resources, and management."
https://now.calpoly.edu/organization/hummus,Hummus Club,"A club for anyone who loves hummus and wants to see if they can enjoy it even more with fellow hummus friends on campus. Kick back, dip a chip, and have a good time. We hummus now."
https://now.calpoly.edu/organization/igniteconsulting,Ignite Consulting Junior Enterprise,Junior Enterprises aims to provide students of higher education with a unique learn by doing experience through managing and working with consulting firms/businesses.
https://now.calpoly.edu/organization/iye,Imagen y Espiritu Ballet Folklorico de Cal Poly,Imagen y Espiritu Ballet Folklorico de Cal Poly is a student-led dance club participating in showcasing Mexican regional dances at various Cal Poly and local community events.
https://now.calpoly.edu/organization/indian-students-assoc,Indian Students Association,ISA is a cultural club open to all South Asian students. We aim to provide a diverse and inclusive environment for all of our members.
https://now.calpoly.edu/organization/idsacalpoly,Industrial Designers Society of America at Cal Poly,"Student Chapter of the Industrial Designers Society of America. Our mission is to create a space where students can gain design experience, build professional networks, and build technical skills."
https://now.calpoly.edu/organization/its-society,Industrial Technology Society,ITS provides operations focused ITP students with networking opportunities with industry professionals
https://now.calpoly.edu/organization/isa,Information Systems Association,Information Systems Association(ISA) is a professional networking club under OCOB that helps connect companies and students for jobs and internship opportunities.
https://now.calpoly.edu/organization/iise,Institute of Industrial and Systems Engineers,"IISE is dedicated to the professional development, education, and involvement of all our members. Some of our events include info sessions with top industry representatives, socials, career fairs, and workshops. We welcome everyone whos interested!"
https://now.calpoly.edu/organization/ite,Institute of Transportation Engineers (ITE),ITE is an organization dedicated to connecting and educating transportation professionals.
https://now.calpoly.edu/organization/isf,International Student Friendship,"The ISF club's goal is to build lasting friendships among international students, scholars and American friends by caring for and fostering their unique interests: physical, social, emotional, and spiritual."
https://now.calpoly.edu/organization/ivslo,InterVarsity Christian Fellowship San Luis Obispo,"InterVarsity SLO is a community of Christ-followers that invites students and faculty from every cultural, spiritual, and ethnic background to be curious about who Jesus is and to experience God’s love as a family."
https://now.calpoly.edu/organization/iranian-student-cultural-organization,Iranian Student Cultural Organization,"ISCO is a non-political, non-religious student organization whose main objective is to host Iranian social activities & events to promote an understanding of the culture while creating a safe environment to foster friendships"
https://now.calpoly.edu/organization/italian-cultural-association,Italian Cultural Association,"The Italian Cultural Association provides a space for students with Italian heritage, or those simply interested in Italian culture, to come together and build community. The ICA hosts regular meetings as well as events throughout the year!"
https://now.calpoly.edu/organization/iter8,iter8 at Cal Poly,"We are Cal Poly's first product design agency for students to gain hands-on Product Design experience. We create a positive space for students to collaborate in teams, design user experience solutions for startups, and develop their portfolios."
https://now.calpoly.edu/organization/jsa,Japanese Student Association,Japanese Student Association (JSA) is a social and cultural club dedicated to sharing and celebrating Japanese culture.
https://now.calpoly.edu/organization/joc,Journalists of Color @ Cal Poly,A safe space for journalists of color at Cal Poly To embrace and encourage diversity in each one’s culture in the field of journalism Learn about how to approach a story that contains diverse topics Approach diversity in a holistically and respectfully
https://now.calpoly.edu/organization/kappa-alpha-theta,"Kappa Alpha Theta, Zeta Theta",Theta teaches us the importance of aspiring to something higher and envelops us in a sisterhood that is loyal and loving.
https://now.calpoly.edu/organization/kkg,Kappa Kappa Gamma,"Panhellenic chapter at Cal Poly that falls under Fraternity & Sorority Life. Kappa Kappa Gamma offers a member experience ranging from friendship to mentoring, from leadership to service, and from campus activities to a lifetime of community involvement."
https://now.calpoly.edu/organization/kkpsi,Kappa Kappa Psi - Iota Pi,Kappa Kappa Psi operates primarily as a student service and leadership recognition society whose chief aim is to assist the Director of Bands in developing the leadership and enthusiasm that is required of their band.
https://now.calpoly.edu/organization/pikapp,"Kappa Pi Associate Chapter of Pi Kappa Phi Fraternity, located at Cal Poly","Pi Kappa Phi is a national men's fraternity founded on leadership in 1904 at the College of Charleston. We are now 120,000 strong, & on more than 180 campuses."
https://now.calpoly.edu/organization/camp-kesem-at-cal-poly-slo,Kesem at Cal Poly,"Kesem is a national nonprofit organization dedicated to supporting children through and beyond a parent's cancer, by hosting a week-long summer camp and fostering a year-round community."
https://now.calpoly.edu/organization/kajakrew,Kaja Krew,"A dance club specializing in K-pop, we are an all levels and experience welcome, inclusive community that consistently performs and records covers."
https://now.calpoly.edu/organization/lambda-chi,Lambda Chi Alpha - Phi Sigma Zeta,on-campus fraternity
https://now.calpoly.edu/organization/lph,Lambda Pi Eta,Lambda Pi Eta is a Communication Studies honor society.
https://now.calpoly.edu/organization/lsg,Lambda Sigma Gamma,"Lambda Sigma Gamma is a multicultural sorority that strives on the diversity of its members. We are an organization that focuses of on our five pillars: Professionalism, Academics,Philanthropy, Sisterhood, & Multiculturalism."
https://now.calpoly.edu/organization/lambda_theta_phi_latin_fraternity_inc,"Lambda Theta Phi Latin Fraternity, Inc.","Lambda Theta Phi Latin Fraternity, Inc. was founded at Kean College in Union, New Jersey on December 1, 1975. We strive for academic success, and uphold our core values of Unity, Respect, Brotherhood, Culture, and Pride."
https://now.calpoly.edu/organization/lacasacommunity,Latine/x Center For Academic Success and Student Achievement (LaCASA),"Nurturing the Latine/x community and their intersectional experiences through transformational programming such as cultural celebrations, educational opportunities, and events centering comunidad. Register for this quarter’s events in our profile."
https://now.calpoly.edu/organization/lia,Latinos in Agriculture,"Latinos in Agriculture (LIA) is a professional and cultural organization dedicated to providing a home away from home for underrepresented students in the College of Agriculture, Food, and Environmental Sciences (CAFES)."
https://now.calpoly.edu/organization/lbsa,Latinx Business Student Association,Latinx Business Student Association
https://now.calpoly.edu/organization/lca,Latinx Cultural Association,"LCA strives to create a fun social environment to learn, share and experience Latinx culture and practices. We aspire to promote a welcoming community open to everyone and give the opportunity to appreciate the various heritages of the Latinx community."
https://now.calpoly.edu/organization/lbdg-awards,Learn by Doing Good Awards,"The Learn by Doing Good Awards honor students, faculty, staff, and organizations who participate in service to the campus and community. It combines the Community Service Awards and LEAD Awards into a new event for 2024."
https://now.calpoly.edu/organization/lettersoflove,Letters of Love,A club where students can come together to have the opportunity to make letters of encouragement to children and families of those who are in local hospitals.
https://now.calpoly.edu/organization/laesclub,Liberal Arts and Engineering Studies,Liberal Arts and Engineering Studies
https://now.calpoly.edu/organization/lifeskills,Life Skills Program,"The Life Skills Program in the Office of the Dean of Students empowers students to build essential life skills to thrive academically, personally and professionally."
https://now.calpoly.edu/organization/loslecheros,Los Lecheros Dairy Club,Los Lecheros Dairy Club was formed for all those passionate about sharing a common interest in the field of dairy science.
https://now.calpoly.edu/organization/msci,Marine Sciences,"The Marine Sciences Club works to unite students across all disciplines who have a passion for marine sciences. We aim to build community, offer members connections to opportunities, and have fun!"
https://now.calpoly.edu/organization/mpp,Mat Pica Pi,"Mat Pica Pi is Graphic Communication's social and professional development club. We aim to connect all generations of GrC, as well as connect our students with professional career opportunities."
https://now.calpoly.edu/organization/mathclub,Math Club,The purpose of Math Club is to provide a safe and inclusive area for people who have a passion for math to make connections. The goal is to bring people together for events throughout the year as well as offer great opportunities to get involved.
https://now.calpoly.edu/organization/mbastudentassociation,MBA Student Association,The purpose of this organization is to create opportunities for Cal Poly MBA students to further their educational and professional development and be a resource for students to connect to professionals within the business world.
https://now.calpoly.edu/organization/mcaa,Mechanical Contractors Association of America,"MCAA competes in several mechanical competitions, fundraises with industry, and travels to conferences. Our Team simulates proposals of a mechanical and plumbing contractor and provides a unique and informative understanding of specialty contracting."
https://now.calpoly.edu/organization/menmasculinitiescommunity,Men and Masculinities Program (MnM),"Collaborating to develop healthy masculinities we create educational events and spaces for men of color and marginalized masculine identities to discuss gender identity, expression, and intersectionality. Register for this quarter’s events in our profile"
https://now.calpoly.edu/organization/club-basketball,Men's Club Basketball,Cal Poly Club Basketball is an intermediate level of competition between the D1 and intramural leagues. This club allows players to continue their love for the game and competitive nature to continue past high school.
https://now.calpoly.edu/organization/menshealthandwellbeingclub,Men's Health & Wellbeing Club,"The Men’s Health & Wellbeing Club aims to educate, support, and unite young college men who are seeking to improve their lives in a holistic way. We provide resources, tools, and community to promote a healthy physical, mental, and social lifestyle."
https://now.calpoly.edu/organization/mens-club-soccer,Men's Soccer Club,"The Cal Poly Men's Soccer Club has grown into one of the top college club soccer programs in the Nation. Fielding 2 full squads, we regularly compete with the best teams in the state as well as the country in leage, regional, and national matches."
https://now.calpoly.edu/organization/cpmvb,Men's Volleyball,A competitive men's volleyball program that plays matches and tournaments in the Northern California Collegiate Volleyball League. We field 2 teams that both play in the National Championships put on by the National Collegiate Volleyball Federation.
https://now.calpoly.edu/organization/cpmwp,Men's Water Polo Club,"Men's water polo completes within the Collegiate Water Polo Association against other schools around the nation. If qualified, the team competes in the CWPA national championships at the end of the season."
https://now.calpoly.edu/organization/mcm,Mercy College Movement,"MCM is a club through a local church called Mercy Church that provides services on campus on Sunday nights, and organizes meetings to proclaim the name of Jesus on Cal Poly's campus!"
https://now.calpoly.edu/organization/mess,MESS,"The Materials Engineering Student Society hosts events for MATE students and offers opportunities to collaborate, study, socialize, and gain information about career options and research."
https://now.calpoly.edu/organization/msc,Military Science Club,"MSC is a social group where CP students and ROTC cadets can come together for friendly gatherings, compete in entertaining games, participate in volunteer events, and have many opportunities to relax and have some fun!"
https://now.calpoly.edu/organization/minnanoanime,Minna No Anime,"Minna no Anime is a group formed to promote, discuss, and appreciate Japanese animation."
https://now.calpoly.edu/organization/calpolymip,Minorities in Physics,"We provide a space for underrepresented identities in physics to connect with one another, talk about common issues/struggles, and ultimately create a supportive and positive community."
