tablescraper-selected-row href,Club Name,Description Excerpt
https://now.calpoly.edu/organization/mexa,Movimiento Estudiantil Xicano de Aztlan (MEXA),We are a social and politically conscious club that aims to empower our Latinx students.
https://now.calpoly.edu/organization/multiculturalcentercommunity,MultiCultural Center (MCC),"The original cultural center at Cal Poly, the center continues to evolve as it serves all communities. We facilitate programs, events and resources to ensure all students develop their sense of belonging. Register for this quarter’s events in our profile"
https://now.calpoly.edu/organization/cpmusicappreciation,Music Appreciation Club,"We are a club that gets together weekly to listen to and share music. Any and all genres, styles, and forms are appreciated! Email us at cpmusicappreciation@gmail.com for more information"
https://now.calpoly.edu/organization/mpu,Music Production Union,"We are a club that promotes music, musicians, and creativity! We have workshops, showcases, jam sessions, social gatherings, and concerts!"
https://now.calpoly.edu/organization/msa,Muslim Students Association,"The MSA is a space for students to gather to learn and grow in the Muslim faith, and it provides resources and support for Muslim students on campus."
https://now.calpoly.edu/organization/mustangaviationclub,Mustang Aviation,"The Mustang Aviation Club advances the science of aeronautics, to develop aviation and to educate pilots in every way towards safe operations."
https://now.calpoly.edu/organization/mband,Mustang Band Club,"The Mustang Band is a large group of brass, woodwind, percussion, and color guard performers that provide entertainment at Cal Poly athletic events."
https://now.calpoly.edu/organization/cpmustangconsulting,Mustang Consulting at Cal Poly,"The purpose of Mustang Consulting is to provide pro bono consulting services to various organizations, community groups, and other entities in need, while providing professional development opportunities for its members."
https://now.calpoly.edu/organization/mustangsurfclub,Mustang Surf Club,Mustang Surf Club is an interest-based social group looking to foster a community of surfers at Cal Poly through social events.  We are open to all surfing skill levels and to those who wish to cultivate a surfing lifestyle with their fellow Mustangs.
https://now.calpoly.edu/organization/recovery,Mustangs for Recovery,"Mustangs for Recovery exists to offer a safe and sober-friendly environment for students in recovery, seeking recovery, or those affected by the addiction of a friend or family member."
https://now.calpoly.edu/organization/mufi,Mustangs United for Israel,"Mustangs United For Israel (MUFI) is the pro-Israel pro-peace coalition with the mission of promoting open bipartisan dialogue, advocating for the Jewish Democratic State of Israel"
https://now.calpoly.edu/organization/namla,National Association of Minority Landscape Architects,NAMLA’s purpose is to increase minority representation at all levels of Landscape Architecture practice and academia.
https://now.calpoly.edu/organization/neca,National Electrical Contractors Association,"Cal Poly National Electrical Contractors Association, student chapter."
https://now.calpoly.edu/organization/nmdp-calpoly,National Marrow Donor Program,"At NMDP℠, we believe each of us holds the key to curing blood cancers and disorders. As a global nonprofit leader in cell therapy, NMDP creates essential connections between researchers and supporters to inspire action."
https://now.calpoly.edu/organization/nsbe,National Society of Black Engineers,"NSBE's mission is to increase the number of culturally responsible Black engineers who excel academically, succeed professionally, and positively impact the community."
https://now.calpoly.edu/organization/naicccommunity,Native American and Indigenous Cultural Center (NAICC),"Aiming to create a pan-indigenous space, we recognize the vast diversity within the Indigenous community by providing a nurturing environment, educational programming, and a place to empower growth. Register for this quarter’s events in our profile."
https://now.calpoly.edu/organization/net-impact,Net Impact,Net Impact is a community dedicated to empowering students with opportunities to learn about and engage with the power of sustainable business as an agent for change.
https://now.calpoly.edu/organization/orientation,New Student & Transition Programs,"Cal Poly Orientation is a tradition that has helped welcome new Mustangs to campus, connect students, parents and supporters and community members to Cal Poly, and build life-long relationships for over 60 years."
https://now.calpoly.edu/organization/ncc,Newman Catholic Club,We serve the students of Cal Poly through hosting weekly and quarterly events.
https://now.calpoly.edu/organization/cpslonsu,Nikkei Student Union,NSU is an inclusive Japanese/Japanese American cultural and social club that aims to promote awareness of Japanese and Japanese American culture and engage members in the community.
https://now.calpoly.edu/organization/nice,Nuclear is Clean Energy,"We aim to educate club members, Cal Poly students, and members of the community about reactors, waste, and tech. Through events, public outreach, and talks we will engage with members of the public about the use of nuclear power in energy infrastructure."
https://now.calpoly.edu/organization/nutrition,Nutrition Club,"Nutrition Club is a place for foodies and those with an interest in health and nutrition to meet, make connections, and learn more about jobs and opportunities in food and nutrition-related fields."
https://now.calpoly.edu/organization/chi-omega,Omicron Mu Chapter of the Chi Omega Fraternity,"An Inclusive, Genuine, and Supportive Sisterhood that Celebrates Individuality and Advocates for Positive Change."
https://now.calpoly.edu/organization/cponehealthclub,One Health Club,"One Health is an integrative approach to solving complex global health issues connecting people, animals, and our shared environment."
https://now.calpoly.edu/organization/order-omega,Order of Omega,Order of Omega is an international honors society that initiates the top 3% of Greek scholars and leaders on college campuses across the U.S. and Canada.
https://now.calpoly.edu/organization/ocf,Orthodox Christian Fellowship,Orthodox Christian Fellowship (OCF) is the official collegiate campus ministry program under the Assembly of Canonical Orthodox Bishops of the United States of America.
https://now.calpoly.edu/organization/ostem,"Out in Science, Technology, Engineering, and Mathematics (oSTEM)","oSTEM provides a space for LGBTQ+ persons pursuing STEM degrees to connect and thrive through outreach events, professional development, and community building among individuals who are passionate about the intersection of the queer experience and STEM."
https://now.calpoly.edu/organization/pfp,Parent and Family Programs,"Parent and Family Programs provides support, resources and exciting programming for the proud parents, family members and supporters of Cal Poly students."
https://now.calpoly.edu/organization/penguins,Penguins Motorcycle Club,"Motorcycle riding club, both dirt and street"
https://now.calpoly.edu/organization/pat,Phi Alpha Theta at Cal Poly,Phi Alpha Theta is a professional society for students interested in history. We promote the interest in history and connect students and faculty together through academic and social events.
https://now.calpoly.edu/organization/phideltcalpoly,Phi Delta Theta Fraternity - California Nu Chapter,"Phi Delta Theta is the pinnacle of fraternal and professional societies, centered on the potential of each brother, the unquenchable thirst for personal development and the lifelong values of friendship, sound learning and rectitude."
https://now.calpoly.edu/organization/fiji,Phi Gamma Delta,Phi Gamma Delta
https://now.calpoly.edu/organization/phikappapsi,Phi Kappa Psi California Eta,Social Fraternity -Group of gentlemen banded together based on similar ideals and values. -Fraternity created in 1852 based on the great joy of serving others.
https://now.calpoly.edu/organization/philosophy-club,Philosophy Club,"Come to Philosophy Club, where we share our philosophical research and discuss contemporary and historical philosophy, politics, and ideas. Open to all majors and all people with an open mind and a love of discussion."
https://now.calpoly.edu/organization/pax,Pi Alpha Xi,To promote the learning and love of horticulture and crop science through plants.
https://now.calpoly.edu/organization/pcecpslo,Pilipino Cultural Exchange,"The Pilipino Cultural Exchange (PCE) prides itself on providing a ""home away from home"" to anyone who seeks it. You do NOT need to be Filipino to join! All are welcome."
https://now.calpoly.edu/organization/ppga-cpslo,Planned Parenthood Generation Action,"Planned Parenthood Generation Action is the college affiliate of the Planned Parenthood Action Fund. We strive to create an organization that advocates for reproductive justice, freedom, and awareness. Come to build community and spread awareness!"
https://now.calpoly.edu/organization/plantfuturesclub,Plant Futures Club,"Plant Futures is a place for students interested in learning more about plant-centric food systems and developing their personal and professional network in this industry. We are affiliated with the non-profit organization, Plant Futures Initiative."
https://now.calpoly.edu/organization/pppclubcp,"Plants, Peaks, Pals","Plants, Peaks and Pals is a club dedicated to helping fellow students learn more about the natural world around them including topics such as geology, botany, and ecology by inviting you and friends on hikes exploring the natural landscape of SLO county."
https://now.calpoly.edu/organization/pokemonclub,Pokémon TCG & VG Club,"A safe and welcoming space to learn and play the Pokémon TCG(Trading Card Game) &amp; VG(Video Game), and collect cards with friends! Also including in-house tournaments to express your competitive spirit and win some prizes!"
https://now.calpoly.edu/organization/psc,Political Science Club,The Political Science Club provides students with the opportunity to learn more about politics and government and to meet faculty and other students.
https://now.calpoly.edu/organization/pcdc,Poly Child Development Club,"We are a club dedicated to serving children, each other, and the broader community by learning, volunteering, and going beyond the classroom."
https://now.calpoly.edu/organization/poly-pack,Poly Pack,"Poly Pack aims to connect students in the packaging concentration with peers, professors, alumni, and professionals and offer insight on career development within the packaging industry."
https://now.calpoly.edu/organization/calpolypups,Poly Pups,Poly Pups is a volunteer puppy raising club for the non-profit organization Guide Dogs for the Blind. Poly Pups helps socialize and train future guide dogs for the blind and visually impared.
https://now.calpoly.edu/organization/polycongaming,PolyCon Tabletop Gaming,"PolyCon Tabletop Gaming hosts weekly gaming events where members play board games, card games, and tabletop RPGs. We also run one gaming convention each quarter, with fall and winter being one day events and spring being a whole weekend."
https://now.calpoly.edu/organization/polygoats,PolyGoats Four-Wheel Drive Club,A four-wheel drive club for members interested in off-road vehicles. Members also help each other work on their cars.
https://now.calpoly.edu/organization/pesclub,Power and Energy Society,"Power and Energy Society works to build Cal Poly students' knowledge of the Electric Power industry through opportunities to interact with industrial professionals, industry tours, information sessions, and technical talks."
https://now.calpoly.edu/organization/pre-optometry,Pre-Optometry Club,The Pre-Optometry Club is for anyone interested in learning more about a career in optometry or who wants to learn how to prepare for optometry school.
https://now.calpoly.edu/organization/pridecommunity,Pride Center (LGBTQIA2S),"Empowering people of all sexual orientations, gender identities, and expressions; programming focuses on intersectional community, self-exploration, radical healing, and centering the QTPOC experience. Register for events in our profile."
https://now.calpoly.edu/organization/projectsunshine,Project Sunshine,"Community service club in which trained student volunteers can interact with pediatric patients to provide fun, engaging, and educational activities. We are a college chapter that is part of a larger nationally and internationally recognized organization"
https://now.calpoly.edu/organization/pt-ot,Physical Therapy and Occupational Therapy Club,"Cal Poly's Physical Therapy and Occupational Therapy Club strives to create a social network between students, faculty, alumni, and professionals."
https://now.calpoly.edu/organization/cpphc,Public Health Club,"CPPH Club promotes wellness among our peers and local community, promotes protective health behaviors, connects students with local public health efforts, and shares information on careers and graduate school programs."
https://now.calpoly.edu/organization/cppuente,PUENTE @ Cal Poly,"Puente @ Cal Poly is a community where Puente students and other Cal Poly students can feel connected through leadership, culture and community service opportunities, in order to cross the bridge to success!"
https://now.calpoly.edu/organization/pulse,PULSE,"Peers Understanding, Listening, Supporting, Educating (PULSE) is a nationally awarded Peer Health Education program that supports the health and well-being of all Cal Poly students."
https://now.calpoly.edu/organization/quac,Quantitative Analysis Concentration Club,"This club was formed to help students better understand the Orfalea College of Business' Quantitative Analysis concentration, as it seems that many undergraduate students are unsure of what the program offers and entails."
https://now.calpoly.edu/organization/quantum-computing-club,Quantum Computing Club,"To create a club dedicated to learning, innovating, and increasing Cal Poly’s involvement with the rapidly developing area of quantum computing. We want to help prepare students for a future quantum computing position in higher education or industry."
https://now.calpoly.edu/organization/rfc,Real Food Collaborative,"We are a student group focused on advocating for and creating community around real, local, sustainable, seasonal, ethical, equitably sourced food for all."
https://now.calpoly.edu/organization/rfislo,Regeneration Field Institute in San Luis Obispo,RFI in SLO is an educational and immerse student organization dedicated to redefining the way we design structures and contribute to the environment. We study bamboo construction and opportunities abroad for hands-on experience working with the material.
https://now.calpoly.edu/organization/rho-phi-lambda,Rho Phi Lambda,"A professional Recreation, Parks, and Leisure National Honorary Society that aspires to recognize, promote & encourage students of high moral character and unselfish devotion to the study, research & application of knowledge."
https://now.calpoly.edu/organization/roller-hockey,Roller Hockey,The Roller Hockey Club is made up of multiple competitive teams that compete in the WCRHL. The club offers participation to players of all skill levels. Come join and try out for our inline hockey team.
https://now.calpoly.edu/organization/rsa,Russian Speaking Association,"A club that fosters a welcoming and inclusive community for all Russian-speaking individuals on the Cal Poly campus by focusing on culture and language-based activities such as language conversation tables, movie nights, and cookouts."
https://now.calpoly.edu/organization/safer,Safer,"Safer is Cal Poly’s primary confidential resource for addressing sexual assault, intimate partner violence, domestic violence, stalking, sexual exploitation and harassment."
https://now.calpoly.edu/organization/sailing,Sailing Team,The Cal Poly Sailing Team is a competitive Club Sport team at Cal Poly. The team competes in regattas sanctioned by the Inter-Collegiate Sailing Association of North America.
https://now.calpoly.edu/organization/sec,Sales Engineering Club,Cal Poly SEC serves to increase student awareness and interest of sales engineering as a rewarding career path.
https://now.calpoly.edu/organization/sgi_usa,SGI-USA Buddhism,"We represent SGI-USA, a Buddhist organization based on Mahayana scripture and on the Lotus Sutra in particular. We will be discussing Buddhism in America, and in the context of our daily lives."
https://now.calpoly.edu/organization/shpe,SHPE,"The Society of Hispanic Professional Engineers (SHPE) recruits, retains and graduates the next generation of Hispanic engineers."
https://now.calpoly.edu/organization/sigma-alpha,Sigma Alpha,"A professional agricultural sorority, cultivating women in their professional, social, scholarship and leadership goals."
https://now.calpoly.edu/organization/sigma-kappa,SIGMA KAPPA SORORITY Epsilon Omega,"Sigma Kappa encourages an atmosphere which will foster high ideals of friendship among college women, promote their educational and cultural interests, and develop in them high qualities of character."
https://now.calpoly.edu/organization/sigma-nu,Sigma Nu Kappa Pi Chapter,"A fraternity dedicated to professionalism, and philanthropic activities both on and off campus. We live by our motto love, truth & honor and make sure all of our members uphold these values in their everyday lives."
https://now.calpoly.edu/organization/aepi,Sigma Omega Chapter of Alpha Epsilon Pi,"Alpha Epsilon Pi is the Jewish fraternity on campus. We provide a unique brotherhood that creates a safe environment for Jewish men looking to make deep relationships, participate in charity, and grow as an individual."
https://now.calpoly.edu/organization/son,Sigma Omega Nu,"Sigma Omega Nu is a Latina Interest sorority that promotes the objectives of Academics, Cultura, and Sisterhood. The sorority provides a home away from home and a support system to help its members get through college."
https://now.calpoly.edu/organization/sigmaphidelta,Sigma Phi Delta,The premier international fraternity of engineers.
https://now.calpoly.edu/organization/sigep,Sigma Phi Epsilon California Tau,"SigEp is redefining fraternity on college campuses across the country. We complement a man’s education by delivering a premier student experience in one of the most formative times of his life. Through SigEp, men strengthen their character, build leaders"
https://now.calpoly.edu/organization/sigmapisigma,Sigma Pi Sigma,The Cal Poly SLO Chapter of The National Physics Honor Society Sigma Pi Sigma.
https://now.calpoly.edu/organization/ssa,Sikh Student Association,"A club to unite Sikh/Punjabi students at Cal Poly. The focus of this club will be to uphold the pillars of Sikhi through volunteerism, meditation, and honest living. This club will also coordinate culturally and religiously relevant activities."
https://now.calpoly.edu/organization/slo-breakers,SLO Breakers,"SLO Breakers promotes a community based on hip hop culture. The club's main focus is to provide a creative, inclusive, and inspiring atmosphere for people who are interested in one of the five elements of hip hop, breaking."
https://now.calpoly.edu/organization/slocccalpolyclub,SLO Climate Coalition Cal Poly Club,The SLO Climate Coalition Cal Poly Club aims to foster an eco-conscious community at Cal Poly by promoting environmental awareness and sustainable practices. We empower students and staff to make informed choices that positively impact our community.
https://now.calpoly.edu/organization/slohacks,SLO Hacks,"SLO Hacks organizes events year-round dedicated towards building an inclusive hacker community and environment that empowers students with the necessary tools to dream, code, and build projects that contribute to social good."
https://now.calpoly.edu/organization/slo-smash,SLO Smash Community,"Club dedicated to the discussion, celebration, and tournaments for the Super Smash Bros game series"
https://now.calpoly.edu/organization/smileandnod,Smile and Nod,"We are Cal Poly's premier improv comedy team. We practice and perform both short-form improv (theater sports), and long-form improv. In the past, we have performed live in Phillips Hall for the first 7 weeks of the quarter."
https://now.calpoly.edu/organization/sampe,Society for the Advancement of Material & Process Engineering,"Research and Development with the use of Composite Materials. Common application and advisement for use of Carbon Fiber, Fiberglass, and green composite materials for other clubs."
https://now.calpoly.edu/organization/saf,Society of American Foresters,"We are the Cal Poly student chapter of the Society of American Foresters, and we work to build relationships with industry professionals and our fellow students."
https://now.calpoly.edu/organization/sce,Society of Civil Engineers,"SCE is a club that promotes personal, professional, and educational development with social, professional, and academic events and opportunities. Home of the nationally-ranked Concrete Canoe and Steel Bridge Teams."
https://now.calpoly.edu/organization/senve,Society of Environmental Engineers,Professional organization that introduces students to industry professionals and possibilities after graduation.
https://now.calpoly.edu/organization/sme,Society of Manufacturing Engineers,Our mission is to connect students of all majors at Cal Poly through manufacturing and to provide a place on unity on campus.
https://now.calpoly.edu/organization/sps,Society of Physics Students of Cal Poly,We support and foster a community for all physics majors/minors at Cal Poly.
https://now.calpoly.edu/organization/swe,Society of Women Engineers,"SWE is a collegiate section of the international organization that works to promote gender equality in engineering through professional development, community outreach, and on-campus membership activities."
https://now.calpoly.edu/organization/sasa,South Asian Student Association,"To serve as a welcoming space centering the most marginalized within South Asia on the basis of race, ethnicity, region, caste, class, religion, gender, and sexuality focused on co-existence and solidarity within and beyond South Asia."
https://now.calpoly.edu/organization/clubdeespanol,Spanish Club,Hosting Spanish conversation hours and Hispanic cultural events since 1980. Instagram: @calpolyespanol
https://now.calpoly.edu/organization/sproutup,Sprout Up,"Sprout Up provides free, youth-led environmental education programs to 1st & 2nd grade classrooms in public schools throughout California and New York City."
https://now.calpoly.edu/organization/statclub,STAT Club,"This organization is a place for Cal Poly Statistics majors, minors, and enthusiasts to come together to network and learn about shared interests"
https://now.calpoly.edu/organization/seaoc,Structural Engineers Association of California Cal Poly Student Chapter,SEAOC serves as a professional club for students interested in the Architectural Engineering/Structural Engineering Field.
https://now.calpoly.edu/organization/safe,Student Association for Fire Ecology,SAFE is focused on fostering a community of individuals from any major who are interested in fire ecology. We provide networking opportunities to acquire and prepare for summer positions and post-graduate careers in fire.
https://now.calpoly.edu/organization/culture,Student Diversity and Belonging,"Student Diversity and Belonging is a collective of campus resource centers that support and empower students experiencing marginalization, through intersectional advocacy and cultural connections to build a more just and equitable Cal Poly community."
https://now.calpoly.edu/organization/sfij,Students for Immigration Justice,"This organization was formed due to immense student interest in affairs related to Immigration Activism. Our aim is to provide members with resources, information, and an engaged community around the subject: centered upon outreach."
https://now.calpoly.edu/organization/cpsjp,Students for Justice in Palestine,"Providing a safe space for students of all backgrounds to freely voice their opinions and feelings in support of Palestine. We plan to strengthen awareness for the liberation of the Palestinian people, by promoting educational events."
https://now.calpoly.edu/organization/studentsforlife,Students for Life at Cal Poly,This is a pro-life club that promotes the culture and importance of life on campus. We also want to be a place to go if a female student happens to become pregnant and is in need of resources.
https://now.calpoly.edu/organization/studentswithdependents,Students with Dependents (DOS),A program of the Dean of Students to support Cal Poly Students with Dependents.
https://now.calpoly.edu/organization/studentsstage,Students' Stage,We’re Cal Poly’s only theatre club on campus! Students’ Stage has been a platform for students and theatre-lovers to collaborate and have fun doing theatre. Our doors are open to theatre practitioners of all backgrounds and every level.
https://now.calpoly.edu/organization/sac,Studio Art Club,We are an all inclusive club that houses a variety of majors. We welcome anyone in the Art & Design department and anyone else interested in expanding their knowledge or getting more involved in the arts on & off campus.
https://now.calpoly.edu/organization/cpsustainablefashion,Sustainable Fashion Club,"This club will be used to inform students of the benefits of sustainable fashion practices, celebrate creativity, and create space for students of all intersecting identities. Our three main goals are education, artistry, and community."
