,Unnamed: 0,tablescraper-selected-row href,New Club Name,New Description
119,121,https://now.calpoly.edu/organization/psi-chi, cal poly psi chi chapter, psi chi national honor society psychology student psi chi platform student form meaningful connection peer faculty member explore career path network within community otherwise
120,122,https://now.calpoly.edu/organization/publicpolicy, cal poly public policy club, mpp student-led platform design master ’ public policy student foster rich discussion professional development practical policy application workshop networking event community outreach
121,123,https://now.calpoly.edu/organization/calpolyquantclub, cal poly quantitative finance club, organization dedicate educate student field quantitative finance include member lead presentation seminar lead industry professional hand group project
122,124,https://now.calpoly.edu/organization/cpre, cal poly real estate club, expose student many different facet within real estate industry
123,125,https://now.calpoly.edu/organization/cprcc, cal poly red cross club, red cross strives extend humanitarian effort american red cross community certification class blood drive visit healthcare professional promote safer healthier campus
124,126,https://now.calpoly.edu/organization/rfid, cal poly rfid and iot club, promote project education around rfid iot technology especially business application
125,127,https://now.calpoly.edu/organization/polyroundnet, cal poly roundnet club, hub spikeball ( sport roundnet ) ! goal every person come meeting learn love game promote ! follow u information instagram @ calpolyspike
126,128,https://now.calpoly.edu/organization/rowing, cal poly rowing club, row aim provide mustang experience level opportunity either discover continue participation sport row cprc member expect row boat range single scull way eight
127,129,https://now.calpoly.edu/organization/rugby, cal poly rugby club, sport team
128,130,https://now.calpoly.edu/organization/cpsalsa, cal poly salsa club, since salsa ( cpsalsa ) dedicate promote salsa bachata form afro-latin social dance san luis obispo rest central coast learn dance u partner experience necessary !
129,132,https://now.calpoly.edu/organization/cpsec, cal poly security education club, group security-oriented individual aim teach develop security expertise weekly talk hands-on activity competition interdisciplinary research open major compute disciplinaries
130,133,https://now.calpoly.edu/organization/cpsloverwatch, cal poly sloverwatch club, sloverwatch connect overall esports community campus welcome environment casual competitive player video game overwatch primary purpose provide fun event make friend !
131,134,https://now.calpoly.edu/organization/cp_sociologyclub, cal poly sociology club, organization provide sociology student support within major connection department local organization help student find niche within sociological field
132,135,https://now.calpoly.edu/organization/cpsicc, cal poly south indian cultural club, space celebrate preserve empower south indian culture diaspora
133,136,https://now.calpoly.edu/organization/svdc, cal poly student veterans and dependents club, military connect student build community provide resource
134,137,https://now.calpoly.edu/organization/surfrider, cal poly surfrider foundation, student chapter surfrider foundation national non-profit organization dedicate protection enjoyment world 's ocean beach wave many program focus education advocacy coastline
135,138,https://now.calpoly.edu/organization/survivor, cal poly survivor club, creates opportunity student meet new people compete excite strategic game base hit cbs tv show survivor n't want play also join welcome community reality tv lover
136,139,https://now.calpoly.edu/organization/calpolyswimclub, cal poly swim club, beginner former ncaa division swimmer swim fun competitive offer training swimmer ability part cisca cc
137,140,https://now.calpoly.edu/organization/cpswing, cal poly swing club, group dancer love lindy hop charleston collegiate shag balboa various variety swing level welcome ! free lesson sunday 1-3pm dance madonna inn every monday 8-10pm dance around !
138,141,https://now.calpoly.edu/organization/table-tennis, cal poly table tennis club, table tennis group student interested develop skill table tennis encourage supportive environment welcome ability level also offer opportunity competitive recreational play
139,142,https://now.calpoly.edu/organization/calpolytaga, cal poly taga club, taga technical association graphic art hands-on competitive graphic communication focus design produce technical research journal introduce student graphic printing industry
140,143,https://now.calpoly.edu/organization/calpolytechsales, cal poly tech sales club, 's new b2b software sale ( tech sale ) want give student specifically student opportunity learn get involve saas sale focus help student become bdrs sdrs account executive
141,144,https://now.calpoly.edu/organization/tec, cal poly textile engineering club, goal 's textile engineering represent synthetic material engineering provide opportunity develop textile student aim establish connection industry work polymer fiber plastic
142,145,https://now.calpoly.edu/organization/theisms, cal poly theisms club, promote open-minded thoughtful reflection upon issue important religious study activity speaker program
143,146,https://now.calpoly.edu/organization/unicycle, cal poly unicycle club, unicycle exists teach anyone interested ride unicycle first time also level skill exist rider hope promote sport unicycle within campus community safe fun environment
144,147,https://now.calpoly.edu/organization/cpurbanists, cal poly urbanists club, look promote real world application planning principle order empower student enact change wish seek campus activism community engagement
145,148,https://now.calpoly.edu/organization/valorant, cal poly valorant club, one-stop valor campus welcome casual competitive valor player !
146,149,https://now.calpoly.edu/organization/vanlifeclub, cal poly van life club, van life/ tiny-house base focus travel recreation & alternative living member also discus diy camper conversion ownership vehicle require participate welcome !
147,150,https://now.calpoly.edu/organization/water-ski, cal poly water ski team, water ski team promotes sport competitive water skiing west coast national level provide student skill level access practice coach slalom trick jump event
148,151,https://now.calpoly.edu/organization/cpwomeninbusiness, cal poly women in business association, found spring woman business association create act resource community young woman work provide student skill network need succeed college life
149,152,https://now.calpoly.edu/organization/womensclubbaseball, cal poly women 's club baseball, baseball team give woman opportunity play learn baseball compete game tournament woman 's team college want grow community woman sport build community
150,153,https://now.calpoly.edu/organization/cpwcvb, cal poly women 's club volleyball, woman 's volleyball offer intercollegiate competition volleyball level
151,154,https://now.calpoly.edu/organization/cpwp-womens, cal poly women 's club water polo, woman 's water polo team group athlete compete tournament pacific coast division collegiate water polo association inclusive team collectively share love game
152,155,https://now.calpoly.edu/organization/calpolywlax, cal poly women 's lacrosse team, home 7-time national champion woman 's lacrosse competes division & division ii western woman 's lacrosse league play various team throughout california
153,156,https://now.calpoly.edu/organization/wrestling, cal poly wrestling club, provide opportunity student begin continue wrestling career stay involve wrestling community
154,157,https://now.calpoly.edu/organization/calpolyyogaclub, cal poly yoga club, yoga recreational organization provide safe inclusive space student learn practice enjoy yoga acro yoga together free partner experience equipment need @ calpoly.yogaclub instagram
155,158,https://now.calpoly.edu/organization/yu-gi-oh, cal poly yu-gi-oh ! club, yu-gi-oh ! strives create friendly atmosphere interested learn play game yu-gi-oh !
156,159,https://now.calpoly.edu/organization/cpwc," california polytechnic state university , san luis obispo student chapter of the wildlife society", wildlife student chapter wildlife society provide student interested career wildlife networking opportunity workshop meet every thursday 11am
157,160,https://now.calpoly.edu/organization/camellia, camellia club, camellia form create welcome environment student year major relax get know make connection
158,161,https://now.calpoly.edu/organization/camp-polyhacks, camp polyhacks, camp polyhacks organizes annual hackathon brings together interdisciplinary student building community social entrepreneurship
159,163,https://now.calpoly.edu/organization/cpcc, can of worms comedy club, worm comedy want venture dazzle world stand-up comedy ! whether like watch perform stand-up comedy worm open mics theme night workshop showcase year round !
160,167,https://now.calpoly.edu/organization/chabad, chabad student group, chabad student group jewish organization provide student `` home away home `` chabad dedicate increase awareness knowledge tradition judaism central coast
161,168,https://now.calpoly.edu/organization/chidelts," chi delta theta sorority , incorporated", chi delta theta strives promote siblinghood academic community service cultural awareness social activity life member
162,169,https://now.calpoly.edu/organization/xe, chi epsilon honor society, chi epsilon national civil engineering honor society united state honor student exemplify principle `` scholarship character practicality sociability `` civil environmental engineering profession
163,170,https://now.calpoly.edu/organization/alpha-omicron-pi, chi psi chapter of alpha omicron pi, object fraternity shall encourage spirit fraternity love among member ; stand time character dignity scholarship college loyalty
164,171,https://now.calpoly.edu/organization/calpolypsi, chi sigma chapter of phi sigma iota, psi chapter phi sigma iota high international linguistics honor society recognizes outstanding accomplishment study teach academic related foreign language literature culture
165,172,https://now.calpoly.edu/organization/csa, chinese students ' association, csa social-cultural strives bring people together social event celebrates chinese culture importantly mission create inclusive friendly community
166,173,https://now.calpoly.edu/organization/christian-students, christian students, group believer love lord want meet pursue regardless background
167,174,https://now.calpoly.edu/organization/club34, club 34, 's social art aim build community interdisciplinary creatives host handful social event quarter may include student-run show craft night artist talk movie night
168,175,https://now.calpoly.edu/organization/tennis, club tennis, tennis co-ed team whose goal allow player skill level continue tennis career develop tight-knit group process competitive team travel monthly compete team across nation
169,176,https://now.calpoly.edu/organization/americorps, college corps service opportunities, college corp fellow interested service outside primary host site ? 're right place ! check fun supplemental service opportunity
170,177,https://now.calpoly.edu/organization/cafescouncil," college of agriculture , food , and environmental sciences student council", college agriculture food environmental science one representative come together meeting every tuesday talk different event go college
171,178,https://now.calpoly.edu/organization/cac, colleges against cancer, plan annual relay life large-scale fundraiser benefit american cancer society
172,179,https://now.calpoly.edu/organization/color-coded, color coded, found `` color cod : diversity tech `` student-led organization aim promote professional academic success underrepresented student technology industry
173,180,https://now.calpoly.edu/organization/cessa, comparative ethnic studies student association, comparative ethnic study student association `` purpose provide place supplement educational networking experience student interest comparative ethnic study
174,181,https://now.calpoly.edu/organization/csai, computer science and artificial intelligence, csai brings student together tackle meaningful problem use artificial intelligence
175,182,https://now.calpoly.edu/organization/computingclubcollaborative, computing club collaborative, leader compute organization campus come together create immersive event student !
176,183,https://now.calpoly.edu/organization/crs, computing research society, offer space conduct hands-on research collaborative project literature discussion compute member present find foster skill deeper understand research methodology
177,185,https://now.calpoly.edu/organization/cldc, country line dancing club, country line dance provide engage interactive line partner dance instruction student offer safe environment member learn everything need know country line dance
178,186,https://now.calpoly.edu/organization/cp-drag, cal poly drag club, drag found way give campus queer artist enthusiast way explore embrace
179,187,https://now.calpoly.edu/organization/slocru, cru, cru central coast part cru interdenominational worldwide christian ministry goal give every student opportunity hear respond good news jesus christ
180,188,https://now.calpoly.edu/organization/delight-ministries, delight ministries at cal poly, delight invite college woman central coast christ-centered community foster vulnerability transforms story
181,189,https://now.calpoly.edu/organization/deltachi, delta chi, delta chi campus-affiliated greek fraternity strive benefit life character every one member foster unique brotherhood center around loyalty compassion & gentlemanly conduct
182,190,https://now.calpoly.edu/organization/dsp, delta sigma phi - epsilon rho chapter, delta sigma phi 's mission `` building well men `` `` well man `` define man courage man action man excellence member delta sigma phi value culture harmony friendship
183,191,https://now.calpoly.edu/organization/deltasig, delta sigma pi kappa mu chapter, delta sigma pi professional fraternity organize foster study business university promote closer affiliation commercial world & student commerce
184,192,https://now.calpoly.edu/organization/delta-upsilon, delta upsilon, affiliate fraternity chapter strives bring philanthropy volunteer service campus surround community
185,193,https://now.calpoly.edu/organization/designlab, design lab, design lab provide space designer professional connect collaborate project learn industry
186,194,https://now.calpoly.edu/organization/calpolydesignvillage, design village, design village student-run organization host annual design-build competition direct sponsorship 's ca competitor across country compete alongside student claim winner year 's theme
187,195,https://now.calpoly.edu/organization/disability-alliance, disability alliance, disability alliance seek develop supportive welcome environment student ability create community space peer connection educate disability history culture activism
188,198,https://now.calpoly.edu/organization/adventurers, dragon boating outreach club, affiliate central coast adventurer dragon boat team student opportunity paddle morro bay fun supportive environment provide chance see wildlife build community exercise !
189,200,https://now.calpoly.edu/organization/eco-reps, eco reps, eco rep commit create culture environmental stewardship campus eco rep exemplify motto 'growing greener mind ' play direct role 's advancement sustainability
190,201,https://now.calpoly.edu/organization/eop, educational opportunity program ( eop ), provide admission academic financial support service historically underserved student throughout california
191,202,https://now.calpoly.edu/organization/teachersofcolorlendinglibrary, educators of color, educator color 's purpose create space student color passionate educational field teach primary secondary post-secondary set work administrator student/academic affair personnel
192,203,https://now.calpoly.edu/organization/eimclub, eim club, eim student organization primary focus serve student whether major interested recreation park tourism administration ( rpta ) provide opportunity networking job local business insight
193,204,https://now.calpoly.edu/organization/endoverdose, end overdose at cal poly, end overdose ( c ) non-profit organization base los angel california work end drug-related overdose death education medical intervention public awareness
194,205,https://now.calpoly.edu/organization/eng-student-council, engineering student council, engineering student council serf bridge communication gap engineering student college engineering university provide cohesion cooperation diverse student organization within ceng
195,206,https://now.calpoly.edu/organization/globalengineeringawareness, engineers for global cultural awareness, engineer global awareness space engineer learn different engineering practice worldwide
196,207,https://now.calpoly.edu/organization/esc, environmental sciences club, esc serf introduce student interested environmental science potential career path community service organization recreational activity related environmental science natural resource
197,208,https://now.calpoly.edu/organization/epicmovement, epic movement, epic asian american christian movement focus bring love jesus christ student seek become apart god 's redemptive mission share gospel world-wide
198,209,https://now.calpoly.edu/organization/alphaphi, epsilon chi chapter of alpha phi international fraternity incorporated," alpha phi sisterhood outstanding woman support one another lifelong achievement sisterhood alpha phi stretch coast coast collegiate campus 200,000 member"
199,210,https://now.calpoly.edu/organization/axo, epsilon omega chapter of alpha chi omega, alpha chi omega found provide basis mutual helpfulness congenial fellowship purpose alpha chi omega provide advancement intellectual social moral culture member
200,211,https://now.calpoly.edu/organization/esports, esports council, organization official voice many different esports game exist campus order promote champion need interest activity student engage game community
201,212,https://now.calpoly.edu/organization/hkn, eta kappa nu, electrical computer engineering honor society
202,213,https://now.calpoly.edu/organization/phisigslo, eta septaton chapter phi sigma kappa, eta septaton chapter phi sigma kappa group brother promotes three pillar brotherhood scholarship character life
203,214,https://now.calpoly.edu/organization/sigma-pi, eta-delta chapter of sigma pi fraternity, eta delta chapter sigma pi fraternity international
204,216,https://now.calpoly.edu/organization/fast," fashion , innovation , trendsetting , and styling club", community student interested realm fashion learn skill garment construction style design model fashion photography integrate value sustainable fashion formerly know fast
205,217,https://now.calpoly.edu/organization/fma, financial management association, fma introduces member limitless number career opportunity finance
206,218,https://now.calpoly.edu/organization/food-science, food science club, food science provide opportunity food science student learn possible opportunity achievement food industry
207,219,https://now.calpoly.edu/organization/flc, french language club, french language group dedicate speak practice speak french skill level welcome social event like french-themed soirées mainly practice conversational french
208,220,https://now.calpoly.edu/organization/fnl, friday night live, friday night live campus creates fun free event promote social emotional physical well-being introduce member field behavioral health
209,221,https://now.calpoly.edu/organization/furries, furries at cal poly, join inclusive passionate community furries campus ! organize art workshop furmeets convention info session outreach everything anthro
210,222,https://now.calpoly.edu/organization/fmec, future math educators club, primary goal increase communication foster social connection creation upkeep community among student faculty staff interested study teach mathematics
211,223,https://now.calpoly.edu/organization/slogammaphibeta," gamma phi beta , delta theta chapter", panhellenic sorority
212,224,https://now.calpoly.edu/organization/geccommunity, gender equity center ( gec ), found student gender equity center empowers feminine transgender womxn-of-center gender-expansive student supporter expansive inclusive program register quarter ’ event profile
213,225,https://now.calpoly.edu/organization/cpgig, gender-inclusive gaming, gender-inclusive game social safe space support minority interested game variation leisure activity !
214,226,https://now.calpoly.edu/organization/calpolygg, genetics and genomics club, resource group student interested learn genetic counsel field genetics facilitate discussion host guest practice skill help grow individual future professional
215,227,https://now.calpoly.edu/organization/genkey, genkey sound collective, genkey collective non-audition band focus japanese rock pop r & b funk jazz band aim amplify japanese culture music on-campus !
216,228,https://now.calpoly.edu/organization/gdsc, google developer student clubs, google developer student ( gdsc ) university-based community group student interested google technology program gdscs country around world include undergraduate graduate student
217,229,https://now.calpoly.edu/organization/gsa, graduate student association, official representative body graduate student
218,230,https://now.calpoly.edu/organization/guac, graduate unified arce club, graduate student pursue career structural engineering goal foster community diverse student primarily undergraduate institution would help foster professional social skill
219,231,https://now.calpoly.edu/organization/growcrew, growcrew, promote practice awareness access sustainable innovative idea control environment agriculture
220,232,https://now.calpoly.edu/organization/guardianscholars, guardian scholars, guardian scholar office dean student
221,233,https://now.calpoly.edu/organization/hack4impact, hack4impact, student-run ( c ) ( ) organization empowers engineer designer activist humanitarian create last social change develop project local nonprofit foster wider adoption software tool social good
222,234,https://now.calpoly.edu/organization/hercampuscalpoly, her campus at cal poly, online magazine cater collegiate woman open join magazine great way get real experience editorial medium journalism marketing event planning industry
223,235,https://now.calpoly.edu/organization/cphiking, hiking and backpacking club, focus unite student diverse background common love outdoors weekly hike quarterly backpacking trip
224,236,https://now.calpoly.edu/organization/hillel, hillel of san luis obispo, san luis obispo hillel center-point jewish life san luis obispo community provide welcome supportive environment student proud engage judaism
225,237,https://now.calpoly.edu/organization/hindu-yuva, hindu yuva, hindu yuva ( youth unity virtue action ) hold meeting conduct event yoga discussion game celebrate festival volunteer community guest lecture hinduism much everyone welcome join !
226,238,https://now.calpoly.edu/organization/horticulture, horticulture club, purpose organization allow student interested horticulture socialize learn plant grow plant hands-on set network industry
227,239,https://now.calpoly.edu/organization/cphuiohawaii, hui o hawai ' i, hui ‘ hawai ' provide home away home student hawai ' community interested culture hawai ' seek spread aloha cultural social event
228,240,https://now.calpoly.edu/organization/hrma, human resource management club, human resource & management association open major focus professional development want offer student place grow learn business human resource management
229,241,https://now.calpoly.edu/organization/hummus, hummus club, anyone love hummus want see enjoy even fellow hummus friend campus kick back dip chip good time hummus
230,242,https://now.calpoly.edu/organization/igniteconsulting, ignite consulting junior enterprise, junior enterprise aim provide student high education unique learn experience manage work consult firms/businesses
231,243,https://now.calpoly.edu/organization/iye, imagen y espiritu ballet folklorico de cal poly, imagen espiritu ballet folklorico de student-led dance participate showcasing mexican regional dance various local community event
232,244,https://now.calpoly.edu/organization/indian-students-assoc, indian students association, isa cultural open south asian student aim provide diverse inclusive environment member
233,245,https://now.calpoly.edu/organization/idsacalpoly, industrial designers society of america at cal poly, student chapter industrial designer society america mission create space student gain design experience build professional network build technical skill
234,246,https://now.calpoly.edu/organization/its-society, industrial technology society, provide operation focus itp student networking opportunity industry professional
235,247,https://now.calpoly.edu/organization/isa, information systems association, information system association ( isa ) professional networking ocob help connect company student job internship opportunity
236,248,https://now.calpoly.edu/organization/iise, institute of industrial and systems engineers, ii dedicate professional development education involvement member event include info session top industry representative social career fair workshop welcome everyone interested !
237,249,https://now.calpoly.edu/organization/ite, institute of transportation engineers ( ite ), ite organization dedicate connect educate transportation professional
