,Unnamed: 0,tablescraper-selected-row href,New Club Name,New Description
358,373,https://now.calpoly.edu/organization/saf, society of american foresters, student chapter society american forester work build relationship industry professional fellow student
359,374,https://now.calpoly.edu/organization/sce, society of civil engineers, sce promotes personal professional educational development social professional academic event opportunity home nationally-ranked concrete canoe steel bridge team
360,375,https://now.calpoly.edu/organization/senve, society of environmental engineers, professional organization introduces student industry professional possibility graduation
361,376,https://now.calpoly.edu/organization/sme, society of manufacturing engineers, mission connect student major manufacturing provide place unity campus
362,377,https://now.calpoly.edu/organization/sps, society of physics students of cal poly, support foster community physic majors/minors
363,378,https://now.calpoly.edu/organization/swe, society of women engineers, swe collegiate section international organization work promote gender equality engineering professional development community outreach on-campus membership activity
364,379,https://now.calpoly.edu/organization/sasa, south asian student association, serve welcome space center marginalize within south asia basis race ethnicity region caste class religion gender sexuality focus co-existence solidarity within beyond south asia
365,380,https://now.calpoly.edu/organization/clubdeespanol, spanish club, host spanish conversation hour hispanic cultural event since instagram : @ calpolyespanol
366,381,https://now.calpoly.edu/organization/sproutup, sprout up, sprout provide free youth-led environmental education program 1st & 2nd grade classroom public school throughout california new york city
367,382,https://now.calpoly.edu/organization/statclub, stat club, organization place statistic major minor enthusiast come together network learn share interest
368,383,https://now.calpoly.edu/organization/seaoc, structural engineers association of california cal poly student chapter, seaoc serf professional student interested architectural engineering/structural engineering field
369,384,https://now.calpoly.edu/organization/safe, student association for fire ecology, safe focus foster community individual major interested fire ecology provide networking opportunity acquire prepare summer position post-graduate career fire
370,386,https://now.calpoly.edu/organization/sfij, students for immigration justice, organization form due immense student interest affair related immigration activism aim provide member resource information engage community around subject : center upon outreach
371,387,https://now.calpoly.edu/organization/cpsjp, students for justice in palestine, provide safe space student background freely voice opinion feel support palestine plan strengthen awareness liberation palestinian people promote educational event
372,388,https://now.calpoly.edu/organization/studentsforlife, students for life at cal poly, pro-life promotes culture importance life campus also want place go female student happens become pregnant need resource
373,389,https://now.calpoly.edu/organization/studentswithdependents, students with dependents ( dos ), program dean student support student dependent
374,390,https://now.calpoly.edu/organization/studentsstage, students ' stage, ’ ’ theatre campus ! student ’ stage platform student theatre-lovers collaborate fun theatre door open theatre practitioner background every level
375,391,https://now.calpoly.edu/organization/sac, studio art club, inclusive house variety major welcome anyone art & design department anyone el interested expand knowledge get involve art & campus
376,392,https://now.calpoly.edu/organization/cpsustainablefashion, sustainable fashion club, use inform student benefit sustainable fashion practice celebrate creativity create space student intersect identity three main goal education artistry community
377,393,https://now.calpoly.edu/organization/soc, systems optimization club, system optimization strives develop student professionally socially engineering-related project networking opportunity
378,394,https://now.calpoly.edu/organization/taiwaneseculturalorganization, taiwanese american student association, tco ( taiwanese cultural organization ) student-run organization focus promote taiwanese culture asian american inclusion campus !
379,395,https://now.calpoly.edu/organization/take-it-slo, take it slo, take gender cappella group make student various year broad range major ! rehearse perform around campus san luis obispo recently release new single ! check instagram @ takeitslo !
380,396,https://now.calpoly.edu/organization/tbp, tau beta pi, tau beta pi national engineering honor society tau beta pi seek recognize serve excel area study well demonstrate exemplary character education profession
381,397,https://now.calpoly.edu/organization/tvsa, thai vietnamese student association, thai-vietnamese student association socio-cultural aim promote thai vietnamese culture build strong community various event activity
382,398,https://now.calpoly.edu/organization/ttk, that 's the key, 's key cappella group campus sings song within various genre music
383,399,https://now.calpoly.edu/organization/beta," the cal poly chapter , the epsilon delta of beta theta pi", fraternity campus beta theta pi mission develop men principle principled life achieve core value mutual assistance integrity trust responsibility intellectual growth
384,400,https://now.calpoly.edu/organization/calpolypad, the cal poly pre-law chapter, phi alpha delta professional co-ed pre-law fraternity aspire law student want gain knowledge professionalism brotherhood philanthropy relates law lawyer
385,401,https://now.calpoly.edu/organization/triathlon, the cal poly triathlon team, triathlon team one large sport campus appeal level athlete whether consider veteran swim-bike-runner join complete first triathlon welcome family !
386,402,https://now.calpoly.edu/organization/thecac, the creative anatomy club, creative anatomy focus intersection anatomical science human health art provide space individual celebrate physical difference engage creative educational activity event
387,403,https://now.calpoly.edu/organization/calpolygardenclub, the garden club, inclusive group diverse forward-thinking student vary experience knowledge practice sustainable regenerative agriculture student experimental farm campus
388,404,https://now.calpoly.edu/organization/theheard, the heard at cal poly, many voice one herd
389,405,https://now.calpoly.edu/organization/sla, the honor society of sigma lambda alpha, san luis obispo chapter sigma lambda alpha academic honor society landscape architecture student excel academic success completion % coursework
390,406,https://now.calpoly.edu/organization/lssa, the liberal studies student association, lssa act diverse representation student within liberal study department work closely department faculty voice student opinion build strong liberal study community
391,407,https://now.calpoly.edu/organization/majesties, the majesties, majesty dance center around aesthetic opulence black diasporic dance tradition dedicate community partner collaboration interest-based dance open foster multi-level dance experience
392,408,https://now.calpoly.edu/organization/thenightcapslo, the nightcap, nightcap 's sketch comedy ! create video live performance course term showcase one big show open entire campus
393,409,https://now.calpoly.edu/organization/kappasigmaslo, the nu-alpha chapter of kappa sigma," kappa sigma one large collegiate fraternity north america exemplify 17,000 undergraduate member chapter nu-alpha chapter establish goal create well gentleman leader"
394,410,https://now.calpoly.edu/organization/writerscollective, the writers ' collective, writer ' collective creative write support writer kind weekly workshop give constructive feedback person wish receive experience level genre welcome !
395,411,https://now.calpoly.edu/organization/delta-gamma, theta alpha chapter of delta gamma fraternity, primary purpose foster high ideal friendship promote educaional & cultural interest develop fine quality character
396,412,https://now.calpoly.edu/organization/theta-tau, theta tau, theta tau professional co-ed engineering fraternity group believe much-needed organization campus aspire create environment diverse group engineering student establish last bond peer
397,413,https://now.calpoly.edu/organization/thriftcalpoly, thrift cal poly club, thrift organization provide supportive inclusive close-knit community sustainable innovator crafter thrifters ’ aim grow new generation climate conscious entrepreneur want save earth
398,414,https://now.calpoly.edu/organization/tractorpull, tractor pull club, tractor pull home infamous pull tractor mustang legacy thunder student opportunity travel perform maintenance legacy thunder work together put annual royal tractor pull
399,415,https://now.calpoly.edu/organization/tqsu, transgender & queer student union, activism community building tqsu aim create space betterment lgbtq+ life
400,416,https://now.calpoly.edu/organization/trioachievers, trio achievers, trio achiever program also know student support service ( s ) fund grant u.s department education part service student since
401,417,https://now.calpoly.edu/organization/tpusa, turning point usa at cal poly, tpusa ( c ) non-profit organization whose mission identify educate train organize student promote freedom
402,418,https://now.calpoly.edu/organization/ula, undergraduate law association, undergraduate law association provide resource information law school career legal field
403,419,https://now.calpoly.edu/organization/um, united movement, united movement non-audition dance foster inclusive safe environment people background dance experience welcome grow together dancer individual
404,420,https://now.calpoly.edu/organization/uxfestslo, ux fest slo, ux fest community people interested ux design workshop social event two-weekend designathon participant learn create prototype compete solve real-world problem building portfolio
405,421,https://now.calpoly.edu/organization/veritas, veritas forum at cal poly, veritas forum help student faculty ask life 's hardest question many world 's lead university found answer big `` `` question mission help confront question anew
406,422,https://now.calpoly.edu/organization/vet-science, veterinary science club, organization pre-veterinary student meet discus path vet school require well gain awareness skill need current issue veterinary field
407,423,https://now.calpoly.edu/organization/weekofwelcome, week of welcome, host new student & transition program
408,424,https://now.calpoly.edu/organization/withus, with us, u house within student affair lead team experienced researcher prevention practitioner student affair leader learn www.withus.org
409,425,https://now.calpoly.edu/organization/women_empowered, women empowered, woman empower exists welcome space discussion folk passionate feminist issue educational social focus
410,426,https://now.calpoly.edu/organization/cpwic, women in construction, recognize empower student construction industry change collaboration leadership development leverage connection
411,427,https://now.calpoly.edu/organization/wif, women in finance, illustrate range opportunity female interested finance industry promote development empowerment leadership success woman finance
412,428,https://now.calpoly.edu/organization/women-in-law, women in law, together group dedicate woman eager learn legal profession wil offer support help woman prepare legal profession provide educational environment network support woman
413,429,https://now.calpoly.edu/organization/wip, women in physics, goal provide support female physic major social event professional development conference attendance research opportunity promote benefit physic major regardless gender
414,430,https://now.calpoly.edu/organization/wish, women involved in software and hardware, wish community woman non-binary folk & ally compute major ( ee/cpe/csc/se/laes ) promote recruitment retention woman tech provide mentorship technical networking social opportunity member !
415,431,https://now.calpoly.edu/organization/womens-club-basketball, women 's club basketball, woman 's basketball team make diverse group individual previous basketball experience provide special opportunity woman participate competitive organize sport college level go mustang !
416,432,https://now.calpoly.edu/organization/backcountrysquatters, women 's outdoor adventure club : backcountry squatters, backcountry squatter commit foster participation leadership inclusivity among woman gender-queer folk within outdoor industry community
417,433,https://now.calpoly.edu/organization/futbol-club, women 's soccer, woman 's soccer group highly dedicate student athlete aim play soccer competitive level represent positive light
418,434,https://now.calpoly.edu/organization/slomotion, women 's ultimate frisbee, woman 's ultimate frisbee team travel competes tournament throughout california college team
419,435,https://now.calpoly.edu/organization/wbvc, womens club beach volleyball, woman 's beach volleyball competitive team practice 2-3 time per week participates open tournament well match ups college team
420,436,https://now.calpoly.edu/organization/wxme, women in mechanical engineering, empower support womxn mechanical engineering community event professional development
421,437,https://now.calpoly.edu/organization/zphib," xi xi chapter of zeta phi beta sorority , incorporated", objective zeta phi beta sorority incorporate foster ideal service charity scholarship civic cultural endeavor sisterhood finer womanhood
422,438,https://now.calpoly.edu/organization/ydsa, young democratic socialists of america at cal poly, ydsa dedicate well world well
423,439,https://now.calpoly.edu/organization/younglife, younglife, younglife
424,440,https://now.calpoly.edu/organization/zbtcalpoly, zeta beta tau fraternity eta mu chapter, zeta beta tau fraternity associate interfraternity council brotherhood inspire equip men lead ethical life growth service leadership
425,441,https://now.calpoly.edu/organization/ox, zeta phi chapter of theta chi fraternity, theta chi zeta phi nationally recognize chapter theta chi fraternity san luis obispo
426,442,https://now.calpoly.edu/organization/zeac, zoo and exotic animal careers club, zoo exotic animal career ( zeac ) aim help student find resource increase likelihood get job field zoo aquarium
427,443,https://now.calpoly.edu/organization/gammas, gamma zeta alpha fraternity inc. - omicron chapter, omicron chapter gamma zeta alpha fraternity inc latino interest fraternity foster environment brother succeed academically professionally uplift underrepresented community
